Empresa,Relato
Banco Santander,me chamo ana paula gaglioli fernandes  cpf 309.391.748.47  agência 3808 conta corrente xxxxxx valinhos . minha conta foi bloqueada por volta do dia 280924  percebi pois sou funcionária pública recebo pelo santander e o meu salário não caiu na conta corrente e fiquei preocupada com o ocorrido pois todos receberam menos eu . entrei em contato com atendimento santarder e fui informada que minha conta havia sido bloqueada por suspeita de fraude e que teria que me direcionar a agência. me ausentei do trabalho para ir na agência da prefeitura de valinhos no dia 3010 e resolver essa situação  falei com a gerência que abriu um chamado interno e me informou que a conta havia sido realmente bloqueada por suspeita de fraude e que teria que aguardar e que meu salário estava parado na conta salário e me orientou a ir na agência 3808 e fazer o saque ou transferência para outro banco. passou uma semana sem resposta do banco entrei em contato novamente no atendimento santander pois não recebi nenhum retorno e o problema de não receber pix ou depósito na conta continuava e fui informada que minha conta seria cancelada por desacordo comercial . me ausentei novamente do trabalho e fui na agência 3808 no dia 1010 para resolver e fui informada pela gerência que eu teria que aguardar o processo interno do banco para resolver. perguntei sobre meu cheque especial  que precisava pagar pois tem juros e tentei pagar tanto com meu salário  tanto com pix de outra conta corrente e até depósito no caixa mas nao seria possível pois a conta estava bloqueada e nem boleto eles conseguiram emitir. pediram novamente para eu aguardar mais alguns dias e retonar na agência na próxima semana para ver se a gerência conseguiria emitir um boleto para o pagamento do cheque especial. agora dia 1210 recebi uma carta do serasa e meu nome irá ficar sujo por essa situação que até agora ninguém me explicou que fraude é essa e nem sei os motivos desse bloqueio e impedimento receber meu salário ou depósitos. estou enviando essa mesma carta ao procon e se mesmo assim meu nome for para a serasa  no mesmo dia irei ao ajuizado especial para processar esse banco.
Mercado Pago,em 06 e 08 de julho de 2024 verifiquei o extrato do meu cartão de crédito na qual constava cobrança de 2 serviços no valor 19 dólares cada totalizando 38 dólares que por mim foi efetuado através da topsteperin porem solicitei cancelamento das compras e os valor de 38 dólares foi estornado pelo estabelecimento topsteperin em 10072024. foi solicitado o comprovante junto ao estabelecimento e foi fornecido o comprovante do cancelamento e estorno do valor e repassado para o mercado pago porem o mercado pago somente estornou uma das compras de 19 dólares. faltando ao mercado pago estornar a segunda compra de 19. o comprovante fornecido pelo estabelecimento topsteperin segue em anexo com data hora valor refund reembolso e protocolo.
Nubank,no dia 07102024 fiz uma renegociação da minha fatura onde paguei de entrada o valor de r 30000. e venho recebendo várias cobranças informando que minha fatura está atrasada. entrei em contato com chat e me foi informado que no dia 08 foi feita outra renegociação por conta disso que estou recebendo essas cobranças. mas não fiz outra renegociação fiz uma única renegociação no dia 0710 onde consta o pagamento dos r 30000 e ainda o contrato de renegociação que recebi por email. estou desde o dia 09 recebendo cobranças e ameaças de cancelamento do meu cartão reduziu meu limite e isso é contrangedor para mim... já que fiz toda a minha parte corretamente
Banco do Brasil,solicitei emprestimo junto ao banco do brasil porém a cópia deste contrato nunca me foi disponibilizada para que pudesse analisar taxas de juros nas parcelas.
Nubank,fiz o acordo para pagar divida em atraso porem meu nome esta no registrato
Mercado Pago,no dia 08 de outubro de 2024 eu realizei um pix de r60000 reais pelo mercado pago para uma conta onde era golpe. eu paguei pelo produto para está pessoa no qual esses são os dados número de operação xxx.xxx.xxxxx nome do recebedor rafaela berwanger da silva instituição recebedora pagseguro internet s.a. motivo da denúncia sofri um golpe eu reclamei para o sac e eles pediram para eu aguardar a análise de até 10 dias para recuperar o dinheiro recebi esta mensagem após a análise sem saldo para devolução infelizmente não foi possível recuperar o valor de r 60000. já fiz boletim de ocorrência para recuperar o dinheiro estou em processo para recuperar pois o aplicativo não me enviou nenhuma mensagem me avisando que a conta em que eu estava enviando o pix era possível de golpe.
Mercado Pago,prezada equipe do mercado pago estou escrevendo para expressar minha profunda insatisfação em relação ao bloqueio inesperado da minha conta. até o momento não recebi qualquer aviso ou explicação sobre o motivo desse bloqueio o que é inaceitável especialmente considerando que há dinheiro preso na plataforma. tentei entrar em contato através de diversos emails mas não obtive resposta. essa falta de comunicação é frustrante e gera uma enorme insegurança em relação aos meus fundos. acredito que como cliente mereço um tratamento mais transparente e respeitoso. peço que reavaliem a situação da minha conta e me forneçam uma solução imediata. espero uma resposta rápida e esclarecedora.
Nubank,prezados venho através deste registro deixar documentados que estou com total impossibilidade de arcar com todas dividas que possuo nesta instituição sem comprometer o mínimo para minha subsistência.
Caixa Econômica Federal,eu quero cancelamento de um débito automático que a crefisa tá cobrando de mim no caixa tem não fiz um empréstimo tá cobrando r 159 por mês o contrato de r 2000 bolsa família para não comprar remédio gás pagar a luz água e essa empresa tá cobrando no caixa tem
Banco Bradesco,em 15102024 verifiquei no registrado e o meu nome ainda conta como prejuízo  cartão de crédito  conta corrente na qual constava meu nome sujo cobrança de serviço da conta no valor 2.45414 que por mim foi paga em agencia já cancelei a conta e ainda conta em prejuízo peso para que retire. meus contatos email xxxxxxxxxxxxxxxx.xxx.
Banco Itaú Unibanco,em 15102024 verifiquei no registrado e o meu nome ainda conta como prejuízo  cartão de crédito  conta corrente na qual constava meu nome sujo cobrança de serviço da conta no valor 12386 que por mim foi paga em agencia já cancelei a conta e ainda conta em prejuízo peso para que retire. meus contatos email xxxxxxxxxxxxxxxx.xxx.
Mercado Pago,estava com uma valor na conta e qndo vi tinha descontado uma assinatura que não fiz
Banco do Brasil,em janeiro de 2024 fui contemplado através de sorteio neste grupo de consórcio fui informado na agencia do bb de itajubá mb que após 6 meses eu poderia quitar e receber todo o valor do consorcio então no dia 27092024 voltei na agencia do banco do brasil em itajubá mg efetuei o pagamento no valor de r 1.32717 e fui informado que em três dias uteis receberia o valor e até o presente não obtive êxito já voltei duas vezes na agencia e liguei para o atendimento conforme os protocolos 8828906 e 8828921 porem dizem que esta programado e não consigo receber .
Banco Inter (Banco Intermedium),prezados venho procurar auxílio da senacon para tentar resolver uma demanda minha com o banco inter. mesmo após enviar os boletos para que os empréstimos consignados fossem pagos mensalmente o banco inter continua lançado os descontos na minha nova fonte pagadora. ocorre que não autorizei esses descontos e além do mais não tenho margem suficiente para aportar os valores. diante disso peço ao banco inter que respeite o meu direito de consumidor e retire o lançamento da minha atual folha de pagamento. atualmente estou no cnpq com cargo e matrícula funcional diversa daqueles dados usados anteriormente no momento da contratação do empréstimo. conforme condições pactuadas no contrato que tenho com o banco inter item 9 oa emitente autoriza de forma expressa e na forma da lei o inss ou seu empregador em caráter irrevogável e irretratável a promover os descontosdébitos mediante consignação no benefício previdenciário na pensão ou na folha de pagamento de sua matrícula funcional identificada no item 3.20. tanto o meu órgão pagador empregador quanto à minha matrícula funcional mudaram uma vez que não estou mais na anatel. ademais não autorizei o banco inter a fazer nenhum desconto no meu atual órgão pagador cnpq. a não anuência da minha parte e não observância do banco inter nas cláusulas contratuais já pactuadas anteriormente acaba por violar as condições do contrato. outro ponto que vale suscitar é a inexistência de margem no meu contracheque atual cnpq que seja capaz de comportar a parcelar do inter. a falta de margem alinhada com a quebra de vínculo funcional acaba por me fazer registrar mais uma vez que o banco inter cumpra as obrigações contratuais e permitame que a partir do dia 10102024 até o final da obrigação existente as parcelas sejam pagas via boleto bancário conforme item 10 do contrato caso se verifique qualquer das situações listadas na cláusula 9 oa emitente autoriza o credor desde já em caráter irrevogável e irretratável a proceder com o débito total ou parcial das parcelas devidas nas contas correntes de sua titularidade informadas no item 1.12 do quadro resumo. no caso de impossibilidade do débito em contas correntes a cobrança poderá ser feita por meio de boleto bancário hipótese em que oa emitente agindo com base na boafé prevista no artigo 4º inciso iii da lei nº 8.07890 se compromete a de imediato contatar o credor solicitando a emissão do boleto bancário para efetuar o pagamento. anexo seguem reclamações abertas junto ao bacen resposta do inter e comprovante da continuidade dos descontos.
Mercado Pago,fiz uma negociação em maio com valor de r 780 e tive alguns problemas e não foi aprovado. por algum motivo fazendo contato com eles estão me oferencendo um parcelamento de 12 de 500. mais de 10x o valor negociados. e também a vista o valor está 3x maior. quero efetivar o pagamento mas somente no valor proposto de 780 maximo 1.000 de proposta de pagamento a vista uma vez que esse valor ficou disponivel
Banco do Brasil,hoje dia 15 de outubro  fui suropreendido as 500 da manhã com 3 comprar realizadas ao qual não realizei certamente houve clonagem de cartão realizaram 3 compras acima de 100 reais a partir das 500 da manhã realizei o bloqueio do cartão  porem ao realizar o contato com o banco fui atendido de forma pessima ao qual o atendente não me esclareceu nada e não resolveu o problema. gostaria da restituição do valor para que eu não fique no prejuizo. o banco em momento algum realizou o bloqueio do valor
Caixa Econômica Federal,em 15102024 verifiquei o contrato adimplente no qual consta valor em aberto micro credito de investimento no valor de r 69444 o qual não consigo fazer a negociação para pagamento.
Banco Itaú Unibanco,não me deram opções para parcelar a divida
Banco Inter (Banco Intermedium),devido ao atraso da fatura por descontrole não consegui mais pagar devido ao juros.
Banco Itaú Unibanco,não é possível falar com atendentes no whatsapp para tratar de negociação.
Banco Santander,bom dia tenho 3 contratos junto ao banco santander e nunca me entregaram a copia do meu contrato peço que por gentileza me encaminhem por aqui já tentei por aplicativo e não consigo pela central de atendimento é quase impossível. então estou vindo aqui pedir uma mediação junto ao santander para que eles encaminhem esse documento.
Nubank,tive que formatar o celular e ao instalar o aplicativo da nubank não conseguir entrar na conta liguei para o 0800 591 2117 e fui informando que estava com instabilidade e por esse motivo não iria conseguir acessar a conta onde foi gerado o primeiro seu protocolo xxx.xxx.xxxxx hoje 151024 tornei a ligar onde foi gerado o segundo protolo xxx.xxx.xxxxx pois preciso fazer uns pagamento e fui informando que está passando por instabilidade e informei que preciso ter acesso a conta ai o atendente me pediu pra aguardar onde ele me retorna informando que minha conta está bloqueada e está no time de segurança para avaliar o desbloqueio. porém estou sendo refém da empresa e sem acesso e impossibilitado de pagar as contas
Caixa Econômica Federal,eu não estou mais devendo a caixa más identifiquei no relatório valores que desconheço haja visto que o valor que eu reconheço se encontra em dia.
Banco do Brasil,o banco se recusa a entregar o contrato do parcelamento da fatura do cartão de crédito.
Nubank,minha dívida era r 17.00000 e hoje esta em r 111.47439 em menos de 03 anos percebo que há juros acima da média do banco central na evolução da divida e estão me oferecendo um parcelamento com entrada de r 75538 e mais 36 parcelas de r 49722.
Banco Bradesco,há dias venho tentando um acordo junto ao bradesco e suas assessorias de cobrança mas não há uma flexibilização para pagamento da entrada me impossibilitando de firmar um acordo para pagamento dentro das minhas condições
Banco Inter (Banco Intermedium),comprei um produto por meio do intershop em 10082024 com a promessa de cashback de r 9495 e até o momento não foi creditado. não consigo contato humano para saber o que aconteceu e a solução.
Banco do Brasil,em agosto de 2024 solicitei ao banco a cópia dos contratos referentes aos empréstimos consignados foram enviados apenas os extratos demonstrativos dos contratos vigentes. todavia solicitei uma cópia de todos os contratos incluindo as renovações realizadas em que consta valor da dívida valor da taxa de juros valor da parcela prazo de pagamento etc. não foi enviado.
Nubank,em data verifiquei a o extrato  cartão de crédito  conta corrente na qual constava cobrança do serviço indique o serviço cobrado exemplo seguro título de capitalização etc no valor indique o valor da cobrança que por mim não é reconhecido pois eu não solicitei e não autorizei a contratação. descreva os contatos realizados com a empresa os indicando data horário e o atendimento recebido e informe se o valor contestado foi ou não pago
Caixa Econômica Federal,tem quase 1 mês que não consigo acessar meu contrato no app de habitação da caixa. quando acesso meu contrato aparece a mensagem  contrato líquidado por novo financiamento na caixa. não é possível emitir termo de quitação. fui até minha agência o atendente consultou o contrato e disse que estava tudo certo com o meu financiamento porém continuo sem conseguir acessar. e quando clica em contratos recentes aparece contrato em processamento como seu eu tivesse feito um novo. eu quero saber o que está acontecendo porque se fosse erro no aplicativo já era para ter sido solucionado.
Banco do Brasil,no dia 10092024 fui assaltado em minha residência onde foi efetuado uma transferência bancária via pix para uma conta da caixa econômica federal para thais margues dos santos no valor de r 4.21800. antes houve a tentativa de transferência por 4 vezes para uma outra conta não não houve êxito. em contato com a gerente lilian a mesma informou que não havendo mais saldo na conta da beneficiada a caixa econômica federal nem o banco do brasil fariam o ressarcimento.
Nubank,em 04102024 recebi uma ligação onde falavam que era da nubank e que estavam tentando fazer uma compra de 1.000 nas casas bahia e perguntaram se eu tinha feito a compra e eu disse que não. então fui oriemtada a diminuir o valor das minhas transações de pix para r100 somente nas opções de limite pix dia e limite pix noite porém não disse para colocar r100 no limite para empresas. dessa forma fui orientada a fazer o valor do pix para uam outra conta minha e como é cpf fiz um valor maior que r100 e não fui. depois foi enviado um link onde ele pediu para tentar fazer e quando cliquei era um valor de r50000 falou que nesse link aparecia o nome da pessoa que estava tentando comprar nas casas bahia e para mim ver se ia como a conta foi cnpj o limite não estava alterado para r100 e o pix foi quando eu informei a pessoa ficou um tempo fingindo que etava resolvendo e me mandou mais um link quando eu olhei que era outro valor e outra pessoa me dei conta que tinha caido em um golpe. dessa forme desliguei rapidamente e bloquei o contato onde foi enviado o link a pessoa ainda me retornou algumas vezes mas não atendi. sim fui ingenua. porém entrei em contato com o time da nubak onde o pessoal disse que iria fazer uma análise. tive um retorno que de não era possível estornar o valor porque a conta da pessoa que eu fiz a transferência não tinha mais nada e porque tinha sido feito do meu celular e com a minha senha a transferência. nesse caso o que eu fico mais chateada e incorformada é que essa pessoa que eu fiz a transferência pe cliente da nubank tem conta aberta com vocês não tem nenhuma análise de dados a abrirem conta com vocês imagine quantos golpistas devem ter e eu não tenho culpa que a pessoa não tem o dinheiro mais na conta para vocês devolveram para mim por ser golpe é claro que a pessoa não vai deixar lá. eu espero que eu o meu caso seja revisado. já passei por uma situação parecida com outro banco e eles não mediram esforços em me retornar o dinheiro porque sabia que a pessoa que tinha a conta com eles era uma pessoa golpista.fico no aguardo.
Banco do Brasil,sofri um golpe de pix dia 10.10.2024 as 17h05. fiz contestação da operação no mesmo dia as 19h30 após recuperar minha senha do app no caixa eletrônico e fazer o bo conforme solicitado. entre o golpe e o bocontestação recebi duas ligações do setor de segurança do bb uma as 17h11 de número desconhecido mas que usou o whatsapp 55 41 xxxxxx414 como suporte. outra ligação as 17h50 de xxx.xxx.xxxxx. naquele momento fiquei sem entender quem estava ligando pelo banco e quem era o golpista complementando o golpe. com a cabeça mais fria entendi que a primeira ligação era do golpsita. no mesmo dia liguei para o pagseguro 30047875 denunciando que gopistas estavam usando a instituição para aplicar golpes. eles informaram que a conta foi bloqueada e qualquer valor existente poderia ser recuperado. no dia 11.10.24 fui na agência alterei todas as senhas pois foram bloqueadas pelo bb e complementei a contestação via telefone conforme orientação do atendente da agência.
Nubank,meu limite de crédito era de r 60000 e a minha divida consta com o valor de r 1.42687 percebo que há juros acima da média do banco central na evolução da divida.
C6 Bank,em data verifiquei a o extrato  cartão de crédito  conta corrente na qual constava cobrança do serviço indique o serviço cobrado exemplo seguro título de capitalização etc no valor indique o valor da cobrança que por mim não é reconhecido pois eu não solicitei e não autorizei a contratação. descreva os contatos realizados com a empresa os indicando data horário e o atendimento recebido e informe se o valor contestado foi ou não pago
Caixa Econômica Federal,em meados do mês de julho desse ano o meu cartão de crédito foi bloqueado para compras online. dessa forma procurei desbloquear por telefone. não conseguindo no final do mês de agosto compareci na agência da caixa econômica federal no sia df para solicitar o desbloqueio e atualizar meus dados. porém não foi devidamente desbloqueado e atualizado. sendo assim no final do mês de setembro compareci novamente na mesma agência e abri um chamado para desbloqueio do meu cartão atualização de dados e solicitação de um novo cartão tendo em vista que o meu cartão atual irá vencer em outubro desse ano. no entanto novamente o chamado não foi atendido. assim 15 dias depois compareci em outra agência no pistão sul taguatingadf onde solicitei a atualização dos meus dados e uma nova via do cartão em virtude do vencimento em outubro. entretanto até hoje meus dados não foram atualizados e a nova via do cartão de crédito não foi enviada.
Nubank,estou com restrição mas já paguei
Mercado Pago,em outubro 2024 verifiquei o recebimento de uma fatura apenas contendo juros  cartão de crédito  conta corrente na qual constava cobrança do serviço fatura cartão de crédito no valor de r87886 que por mim não é reconhecido pois eu não solicitei e não autorizei a contratação e não tenho o cartão de crédito informado. contatos realizados antes do dia 310 caso 344598922 felipe segundo contato caso 344748676 ana terceiro caso 346593600 larissa. estou recebedo ligações de cobranças de escritórios que atuam com o mercado pago gerando incomodos diários. não tenho o cartão no qual recebi a fatura os acordos que eu tinha junto ao mercado pago foram de contas de 20222023 que foram negociados e quitados agora em agosto e setembro de 2024.
Banco Santander,boa tarde tudo bem aki e o josepher fernando antunes arruda portador do cpf 018.878.791.70 rg. xxxxxx sspmt preciso por gentileza que vcs retire toda restrição que se encontra no meu nome referente ao cartão de credito santander que se encontra pago  e de todos os órgãos que restringi meu nome principalmente no banco central porque esta interferindo no meu score desde já agradeço fico no aguardo para mais informação
Banco Bradesco,recebo meus dois salários aqui pelo bradesco porém nunca me foi concedido 1 real de empréstimo consignado e nem se quer cartão de crédito. quero saber agora se vão me liberar algum crédito se não for me digam que ao final da reclamação faço portabilidade de salário pra outro banco.
Mercado Pago,no dia 11102024 apareceram 5 compras não realizadas no extrato do meu cartão de crédito visa mercado pago no total de r 58950  11102024 01h04 r 11790 apple.combill sao paulo br  11102024 01h04 r 11790 apple.combill sao paulo br  11102024 01h04 r 11790 apple.combill sao paulo br  11102024 01h05 r 11790 apple.combill sao paulo br  11102024 01h05 r 11790 apple.combill sao paulo br tão logo eu vi na manhã seguinte entrei em contato via app para contestar a cobrança recebendo a informação de que ainda não era possível contestar pois a loja poderia levar até 10 dias para contestar a compra. ontem eu finalmente consegui contestar a cobrança recebendo a resposta de que eu teria feito outros pagamentos para a mesma empresa sem suspeitas de fraude. sim esse cartão virtual está cadastrado na minha conta da apple mas essas compras sequer aparecem em meu extrato com a empresa. o mercado pago deveria ter bloqueado essas cobranças pelo simples fato de que 5 compras sequenciais na madrugada com o exato mesmo valor seriam suspeitas. não obstante verifiquei que no reclame aqui há diversos outros consumidores reclamando do mesmo problema reclamando de cobranças sequenciais não reconhecidas no exato mesmo valor com cartão mercado pago e em relação à apple havendo indícios de que esse problema acontece com muitas pessoas em razão de uma falha entre a apple e o mercado pago que já deveria ter sido solucionada há muito tempo. finalmente deve ser destacado que eu tentei contestar a cobrança a tempo mas o mercado pago não permitiu afirmando que a loja ainda não havia confirmado a compra. seria justamente esse o momento de realizar o bloqueio mas não me permitiram. quando permitiram enfim realizar a contestação informaram que não seria possível em razão de eu ter feito compras anteriores na apple sem suspeita de fraude compras legítimas anteriores na minha conta que não tem nenhuma relação com essa cobrança sequencial. não fosse isso o bastante entre os dias 12 e 14 de outubro eu viajei e precisava do limite do cartão sendo muito prejudicado em razão da indisponibilidade desses r 58950.
Nubank,a empresa nubank está fazendo de uso para cobrança números contratados com sistema automático robôs. a empresa liga em média 20 vezes das 0800 até por volta de 2100. isso impossibilita o uso do aparalho para recebimento de ligações importantes do meu trabalho tendo em vista que a emrpesa não usa um número próprio que possa ser identificado. traz cronstrangimento.
Banco Santander,ao pagar uma divida com desconto banco enviou meu nome pro scr como prejuízo me prejudicando para conseguir crédito. se o banco quis fazer acordo comigo não posso ser prejudicado decisão do stj. solicito a imediata retirada do meu nome sob risco de processo
Nubank,paguei uma dívida com desconto e o banco enviou meu nome para o scr como prejuízo e esta me prejudicando a conseguir crédito.se o banco quis fazer um acordo comigo não posso ser prejudicadosegundo segundo atendimento do stj.solicito a imediata retirada do meu nome de lá.
Caixa Econômica Federal,consta em meu nome no registrato um prejuízo para caixa econômica federal tentei contato com a empresa para renegociar porém no site de renegociação informa que não consta nada em aberto
