Empresa,Relato
Banco do Brasil,solicitação de auxílio para renegociação de financiamento imobiliário. bom dia prezados venho por meio deste solicitar auxílio referente à renegociação do meu financiamento imobiliário. a parcela atualmente é de r 1.00000 mas no momento o valor total se encontra em r 6.72236. ao tentar contato com o banco a única opção disponível pelo aplicativo é uma entrada de r 1.30773 valor que infelizmente não possuo atualmente. ao acionar diversos canais dentro do chat recebi sempre a mesma resposta padrão informando que não há outras alternativas disponíveis. no passado enfrentei dificuldades semelhantes e na época consegui regularizar a situação com a ajuda dos meus pais. contudo nesta ocasião não tenho esse suporte e desejo regularizar minha situação financeira. o imóvel em questão é o único bem que possuo e é importante para mim deixálo para minha filha. dessa forma solicito a possibilidade de renegociar o financiamento com um valor de entrada menor. estou à disposição para receber um contato preferencialmente entre 12h e 13h ou às 19h. por gentileza informem qual número será utilizado para o contato. agradeço desde já a atenção e a colaboração de todos os envolvidos. aguardo um retorno e principalmente a ajuda na renegociação. desejo a todos uma boa semana. atenciosamente
Banco do Brasil,conforme comunicado de superendividamento enviado em demanda aberta anteriormente junto ao bacen sob protocolo 2023755704 data 26102023 venho através deste formalizar minha solicitação de renegociação de dívidas uma vez que não obtive êxito em nenhuma das conversas via consumidor.gov.br procon recife telefone whatsapp e mail e aplicativos do banco e do cartão de crédito onde somente me foi oferecido valores que não tenho condições alguma de pagar diante do meu cenário de superendividamento. sei que os bancos tendem a pedir para que o procon recuse tal demanda mas neste pedido estou seguindo a exata recomendação dada nos moldes do código de defesa do consumidor atualizado pela lei 14.181 em seu artigo 104c. compete concorrente e facultativamente aos órgãos públicos integrantes do sistema nacional de defesa do consumidor a fase conciliatória e preventiva do processo de repactuação de dívidas nos moldes do art. 104a deste código. reforço que nenhuma das minhas propostas eu ofereço pagar menos do que tomei emprestado com as devidas correções pois estou ciente da minha obrigação de pagar o principal emprestado e em nenhum momento tenho intenção premeditada de dar calote ou agir de má fé pois a todo momento venho reforçando através de atos práticos minha boa fé e intenção de negociar de forma que eu consiga pagar minhas obrigações de moradia alimentação saúde e transporte e honrar com as obrigações financeiras e faço isso exatamente para não ter que buscar a justiça pois acredito verdadeiramente que os senhores avaliarão os fatos e estarão dispostos a negociar aqui mesmo na fase conciliatória do superendividamento. com isso esclarecido segue minha proposta de negociação empréstimo  r 24.08061 ofereço proposta para quitar as seguintes dívidasr 18.00000 e posso pagar esse valor apenas de forma parcelada em 60 x de r 30000 sem comprometer a manutenção dos itens básicos para minha família e para que consiga um acordo com todos os meus credores. me coloco a disposição para receber uma contraproposta mas de fato não consigo assumir um valor acima do proposto pois como informei no comunicado anterior hoje no sistema de informações de crédito do banco central  scr minha responsabilidade total em reais é de r 920.62711 em 7 bancos e instituições financeiras.
Banco Itaú Unibanco,meu nome esta scr devedor tenho conta no banco e não tenho divida la
Mercado Pago,fiz uma compra no cartão o valor triplicou em 3 vezes e não consegui pagar tentei negociar pelo preço total não me deram descontos
Banco Inter (Banco Intermedium),na minha contrataão do financiamento imobiliario em agosto de 2021 eu ja tinha a definição de todas as parcelas ja com os juros e taxas ocore que em setembro de 2024 eu fiz uma amortização de r 39.63900 no meu saldo devedor quitando 77 parcelas. porem meu saldo devedor ficou em r 85.11746 ou seja amortizei 30 do meu saldo porem o banco item não recalcula de forma automotatica as parcelas a vencer juntamente com o saldo ou seja eles mantem os juros estipulados no contrato inicialmente com meu prazo menor.
Mercado Pago,o banco mercado pago está comunicando meus dados com outros bancos de forma negativa o meu cadastro e todas as operações de crédito estão sendo comunicadas com intuito de me prejudicar e dificultar o meu acesso a novo crédito no mercado financeiro perante outras instituições. estou com dificuldades de conseguir novos créditos não tenho restrição no serasa e spc mas estou com restrição cadastral perante esta instituição ao qual mantive relação de serviços bancários. a quebra de minha privacidade está ocorrendo com a ampla divulgação de meus dados sobre as operações pagas em dia e pagas em atraso que efetuei com esta instituição para outros bancos. a penalização que estou sofrendo ultrapassa o prazo máximo permitido por lei importante destacar que não estou no serasa ou spc o que está me dificultando o acesso a novos créditos é o fato deste banco estar comunicando com outros bancos meus dados pessoais e de operações realizadas de forma negativa com a finalidade de me prejudicar preciso de que isto seja esclarecido e que estas comunicações parem de ocorrer. art. 43  1º do cdc. os cadastros e dados de consumidores devem ser objetivos claros verdadeiros e em linguagem de fácil compreensão não podendo conter informações negativas referentes a período superior a cinco anos. a comunicação destas restrições cadastrais por este banco aos demais bancos está me prejudicando e penalizando a tempo superior de 5 anos conforme determina a lei. a instituição está dificultando o meu acesso a novo crédito no mercado financeiro em outros bancos e financeiras contrariando o disposto no artigo 43 1 2 3 4 e 5 do código de defesa do consumidor e garantidos também pelo artigo 5 x e xlvii b da constituição federal que versam respectivamente sobre a dignidade da pessoa humana e da proibição de penas perpétuas. conforme protocolo do banco central número 2024884049. eu já tentei resolver meu problema mas não foi resolvido preciso que minha privacidade das operações pagas e as em atraso não sejam divulgados aos outros bancos através desta lista interna negativa. se meu problema não for solucionado desta vez pretendo representar judicialmente contra a esta instituição financeira. observação não estou pedindo para que o banco consulte meu nome nos órgãos de proteção ao crédito eu sei que não estou inadimplente desnecessário essa consulta e também não estou solicitando número ou contato de nenhuma securitizadora de crédito minha solicitação é para pararem de comunicar a restrição cadastral interna que ultrapassa o máximo permitido por lei e para que não seja mais divulgado meu nome e cpf para outros bancos de forma negativa.
Banco Inter (Banco Intermedium),prezados bom dia há alguns dias venho tentando contato com banco inter para liquidar o saldo devedor do meu cartão de crédito sem sucesso o que fere o inciso 2º do art 52 do código de defesa do consumidor que diz é assegurado ao consumidor a liquidação antecipada do débito total ou parcialmente mediante redução proporcional dos juros e demais acréscimos. sendo assim venho por meio desta plataforma solicitar que emitam um boleto com o saldo devedor total dos meus débitos relativos ao cartão de crédito para que eu realize a liquidação.
Banco Santander,eu não dei prejuízo a nenhuma instituição financeira e eles estão mantendo as restrições em meu nome e ligando inúmeras vezes por dia. gostaria muito de resolver isso. desde já agradeço e fico no aguardo de um retorno.
Banco do Brasil,em 21102024 desde 2019 verifiquei a o extrato da conta corrente xxxxxx agencia 0571 na qual constava cobrança do serviço cartão de crédito no valor r 5.45733 constando na lista de prejuízo do banco central. solicito a retirada.
Banco do Brasil,fiz acordo para limpar meu nome e msm assim olhei no registrato meu nome consta como sujo
Nubank,empresa está repassando meus dados nos órgãos do serasa sem minha consciência já tem anos e isso está me prejudicando gostaria que retirasse meu nome dos órgão serasa etc... e entrasse em contato para resolvermos da melhor forma. mais no momentos está vazamentos de dados sem minha autorização.
Banco Itaú Unibanco,paguei minha dívida com desconto a mais de 180 dias para limpar meu nome e esta no aba de prejuízo do bacen me impossibilitando de conseguir crédito no mercado. se o banco fez um acordo comigo eu não posso ser prejudicado por isso.
Banco Santander,o banco gerou uma fatura para mim de cartão de credito no valor de r 127000 reais e o histórico da fatura tratase da mesma coisa. um seguro cartão protegido a qual nunca solicitei de forma alguma nem de forma eletrônica nem presencial nem por caixa eletrônico. essa conta corrente não estava sendo utilizada esse cartão para compras também não estava sendo utilizado. e o banco se nega a cancelar a fatura ou me dar em limite no cartão de credito esse serviço que nunca utilizei inclusive o atendimento se negou a passar a reclamação para ouvidoria do banco me obrigando a ir na agencia sendo que meu horário de trabalho não permite tal ação. e isso impede o banco de me dar limite em cartão empréstimos e demais serviços de credito
Nubank,prezados conforme comunicado de superendividamento enviado em demanda aberta anteriormente sob protocolo n 2024292370 venho através deste formalizar minha solicitação de renegociação de dívidas diretamente pelo procon e bacen uma vez que não obtive êxito em nenhuma das conversas via telefone e pela agência onde somente me foi oferecido valores que não tenho condições alguma de pagar diante do meu cenário de superendividamento sei que os bancos tendem a pedir para que o procon recuse tal demanda mas neste pedido estou seguindo a exata recomendação dada nos moldes do código de defesa do consumidor atualizado pela lei 14.181 em seu artigo 104c. compete concorrente e facultativamente aos órgãos públicos integrantes do sistema nacional de defesa do consumidor a fase conciliatória e preventiva do processo de repactuação de dívidas nos moldes do art. 104a deste código. reforço que nenhuma das minhas propostas eu ofereço pagar menos do que tomei emprestado com as devidas correções pois estou ciente da minha obrigação de pagar o principal emprestado e em nenhum momento tenho intenção premeditada de dar calote ou agir de má fé pois a todo momento venho reforçando através de atos práticos minha boa fé e intenção de negociar de forma que eu consiga pagar minhas obrigações de moradia alimentação saúde e transporte e honrar com as obrigações financeiras e faço isso exatamente para não ter que buscar a justiça pois acredito verdadeiramente que os senhores avaliarão os fatos e estarão dispostos a negociar aqui mesmo na fase conciliatória do superendividamento. com isso esclarecido segue minha proposta de negociação dados da dívida cartão de crédito  r 1.80000 ofereço proposta para quitar a dívida no valor de r 43751 à vista sem comprometer a manutenção dos itens básicos para minha família e para que consiga um acordo com todos os meus credores. me coloco a disposição para receber uma contraproposta mas de fato não consigo assumir um valor acima do proposto pois como informei no comunicado anterior hoje no sistema de informações de crédito do banco central  scr minha responsabilidade total em reais é de r136.67644 em 8 bancos e instituições financeiras. caso seja necessário posso enviar a vocês meu comprovante de pagamento e rendimentos mensais junto com a comprovação de toda minha movimentação financeira onde pago minhas necessidades básicas uma relação de todas as minhas dívidas que são com garantia e sem garantia e também um descritivo detalhado de minhas despesas essenciais mensais pois desde que constatei a minha situação de superendividamento toda minha movimentação está em uma única conta e do mesmo modo que estou encaminhando esse pedido a vocês estou encaminhando para todos os meus credores de outras instituições e não tenho absolutamente nada a esconder ou ocultar. certo da cooperação dessa instituição no seu papel na prevenção e tratamento do superendividamento aguardo retorno por escrito a fim
Banco Itaú Unibanco,meu nome consta no scr  registrato do banco central.
C6 Bank,eu mesmo fiz um pix de um outro banco onde tenho conta para a minha conta do banco c6 e automaticamente foi descontado 799 de taxa de manutenção e logo em seguida uma outra taxa de 800 sendo que nunca tinha acontecido isso antes e nunca fui informado que teria esse descontou ou que passaria a ter em algum momento. nunca concordei com tal desconto nunca houve um contrato ou algum tipo de concordância minha aceitando tal cobrança. fiquei totalmente prejudicado pois eu transferi o valor exato para pagar minha conta de telefone da operadora tim no valor de 8399 ou seja não consegui pagar essa conta pois foi descontado tal valor e foi preciso retirar esse dinheiro para a minha outra conta novamente e completar o valor que foi descontado na minha conta no c6 bank. consto aqui também que só utilizo o c6 bank para pagar minha conta de telefone da tim pois entre os dois citados existe uma parceria que quando eu pago minha conta pelo c6 bank eu ganho um bônus de internet para o meu celular ficando novamente prejudicado pois perdi esse bônus também.
Banco Inter (Banco Intermedium),colocaram meu nome no registrato
Nubank,em 2023 não consegue pagar a fatura do meu cartão de crédito meu cartão foi bloqueado e meu nome negativado porém o valor que estão pedindo para mim pagar em 2024 não tenho condições de pagar pois são juros altíssimos. em data verifiquei a o extrato  cartão de crédito  conta corrente na qual constava cobrança do serviço indique o serviço cobrado exemplo seguro título de capitalização etc no valor indique o valor da cobrança que por mim não é reconhecido pois eu não solicitei e não autorizei a contratação. descreva os contatos realizados com a empresa os indicando data horário e o atendimento recebido e informe se o valor contestado foi ou não pago em data verifiquei a o extrato  cartão de crédito  conta corrente na qual constava cobrança do serviço indique o serviço cobrado exemplo seguro título de capitalização etc no valor indique o valor da cobrança que por mim não é reconhecido pois eu não solicitei e não autorizei a contratação. descreva os contatos realizados com a empresa os indicando data horário e o atendimento recebido e informe se o valor contestado foi ou não pago em data verifiquei a o extrato  cartão de crédito  conta corrente na qual constava cobrança do serviço indique o serviço cobrado exemplo seguro título de capitalização etc no valor indique o valor da cobrança que por mim não é reconhecido pois eu não solicitei e não autorizei a contratação. descreva os contatos realizados com a empresa os indicando data horário e o atendimento recebido e informe se o valor contestado foi ou não pago
Banco Bradesco,gostaria que meu nome fosse retirado do prejuízo revendo leis em vigor para o consumidor
Banco do Brasil,em 10092024 verifiquei a o extrato  cartão de crédito  conta corrente na qual constava cobrança do serviço empréstimo  no valor 21.89200 que por mim não é reconhecido pois eu não solicitei e não autorizei a contratação. tentei negociar os juros são absurdos o valor da negociação é fora da minha realidade está me prejudicando não consigo adquirir a compra de um imóvel para mim por causa da dívida indevida.
Nubank,não consigo crédito em nem um banco
Nubank,fiz uma negociação que iclusive já paguei por completo e meu nome ainda continua no registrato do bc atrapalhando qualquer tentativa de de crédito. em outra ocasião reclamei e me informaram que só retiraria após o pagamento total da negociação pois bem no entanto continua constando. por isso quero aqui pedir que se possível retirem. obrigado
Banco do Brasil,após tentar resolver tanto por telefone chat e pessoalmente na agência e não ter solução alguma venho através deste meio solicitar uma conclusão para meu caso. estou com minha conta travada não conseguindo movimentar valores na mesma pois tempos atrás tive problemas com uma venda realizada em minha outra conta do banco c6 bank por meio do pix ocorre que uma cliente do banco do brasil efetuou essa compra recebeu o serviço e posteriormente abriu uma contestação falsa alegando que não teve o que foi acordado porém isso é totalmente inverdade essa pessoa ágil de má fé para com minha pessoal tanto foi que o c6 bank não aprovou a contestação após analisarem os fatos e me darem resolução do mérito. fato este que na época eu não era cliente do banco do brasil me tornando depois e os senhores do bb estão me impugnando sem ter qualquer conhecimento do caso e agindo com arbitrariedade além de atuarem em algo que foge totalmente do escopo dos senhores cerceando meu livrearbítrio de uso de minha conta como cliente tanto como os demais
Banco Bradesco,paguei a minha divida o qual o banco fez uma oferta do valor em atraso paguei e estou vendo que estou com o nome no scr e o banco não retirou o meu nome do registrato
Nubank,está instituição registrou uma dívida no registrato do bacen que me impede de ter crédito no mercado.
Caixa Econômica Federal,chegou um cartão em minha casa sem eu ter solicitado e não fiquei nenhum pouco feliz. a prática de envio sem solicitação é abusiva segundo o código de defesa do consumidor súmula 532. constitui prática comercial abusiva o envio de cartão de crédito sem prévia e expressa solicitação do consumidor configurandose ato ilícito indenizável e sujeito à aplicação de multa administrativa. não tenho conta na caixa e não quero ter. não quero um cartão da caixa.
Banco Bradesco,solicito a exclusão total dos meus dados e informações de prejuízos e dívidas do registrato inclusive de dívidas prescritas com mais de cinco anos.
Nubank,cai em um golpe comprando itens para revenda na internet golpistas se fizeram passar por uma loja física localizada no brás assim que transferi os r33000 mudaram a forma de atendimento e percebi que se tratava de um golpe entrei imediatamente em contato com a nubank que me pediu para esperar para no final me falar que não conseguiam me ajudar devolvendo o valor transferido.
Mercado Pago,solicito que tirem meus dados do registrato e ou de qualquer empresa de cobrança pois não foi autorizado o compartilhamento de dados pessoais.
Nubank,solicito que tirem meus dados do registrato e ou de qualquer empresa de cobrança pois não foi autorizado o compartilhamento de dados pessoais.
Banco do Brasil,há mesesanos há uma cobrança de tarifa de manutenção de conta contudo o valor cobrado não corresponde aos serviços que utilizo.
Banco Santander,solicito que tirem meus dados do registrato e ou de qualquer empresa de cobrança pois não foi autorizado o compartilhamento de dados pessoais.
Nubank,eu tenho uma dívida com o banco de 4.28466 r porém o banco está cobrando o valor de 20.67566. esse juros são abusivos e vão além do necessário para a situação isso impossibilita que eu quite o débito.
Nubank,por problemas financeiros atrasei a fatura do nubank e cada dia que passa o valor aumenta e estou disposto a pagar e não ofertam uma valor que caiba no meu orçamento.
Caixa Econômica Federal,negativação no scr  sistema de informações de crédito do banco central do brasil.
Banco Inter (Banco Intermedium),prezados peço a gentileza de enviar contrato e saldo devedor atualizado a crédito pessoal  sem consignação em folha de pagamento
Banco Bradesco,em 21 de agosto de 2024 por volta das 1115 fui vítima de furto na avenida prudente de morais próximo ao número 440. após colocar meu telefone em modo perdido no icloud recebi uma mensagem do bradesco por volta das 1330 informando sobre uma tentativa de transferência pix. constatei que essa tentativa estava associada a uma sessão de whatsapp logada no navegador do meu computador pessoal. verifiquei que a mensagem era legítima e ao confirmar que não reconhecia a transação percebi que apesar de meu telefone estar bloqueado para acesso ao face id e ao icloud houve uma falha de segurança no bradesco permitindo que minha conta fosse acessada. pedi ao meu pai que fosse à agência localizada na avenida prudente de morais 1070 por volta das 1345 para solicitar a verificação da conta e o possível bloqueio. mesmo com evidências claras de transações suspeitas a gerente informou que não poderia realizar nenhuma ação sem a minha presença o que ocorreu 15 minutos depois. ao chegar fui informada de diversas transações não autorizadas em minha conta que sempre foi uma conta salário sem saldo e com apenas duas transferências mensais automáticas referentes ao pagamento de salário. além disso fiquei sabendo da existência de um cheque especial no valor de r 30.00000 o qual nunca contratei. em contato com o policial que havia me atendido enviei imediatamente o boletim de ocorrência para a gerente do bradesco. desde então o banco tem afirmado que as transações foram realizadas em ambiente seguro mas sem assumir a responsabilidade pela falha de segurança. o estorno dos valores foi aprovado sob assinatura de um termo o qual eu fui ao banco para ler e assinar mas ao discordar com algumas das cláusulas pedi uma cópia o que foi negado em diversas tentativas pessoalmente whatsapp e emails. para piorar agora o bradesco negativou meu nome no serasa e tem feito cobranças incessantes literalmente de dívidas que não me pertencem.
Banco Bradesco,quero tirar meu nome da lista de prejuízo
Banco do Brasil,verifiquei valores cobrado abusivamente.
Banco Santander,minha divida era r 1.50000 e hoje está em r 2.80000 percebo que há juros acima da média do banco central na evolução da divida
Nubank,no dia 0407 fiz uma renegociação da minha dívida no nubank paguei a entrada porém a empresa não reconheceu meu acordo. desde então tenho entrado em contato inúmeras vezes para resolver a situação e não tenho retorno. agora estão cobrando juros muito altos de um problema que eu estou tentando resolver e o nubank não me responde. assim sendo gostaria de resolver essa
Nubank,minha divida era r 30000 hoje esta em r 48729 percebo que há juros acima da média do banco central na evolução da divida
Nubank,entrei com contato com o banco digital nubank afim de esclarecimento sobre prejuízo no bacen e negativação no serasa fui informado que já foi retirado o cpf no serasa e boa vista e desconhece prejuízo no banco central protocolo de atendimento xxx.xxx.xxxxx. preciso fazer um financiamento e consta restrição no bacen.
Banco Santander,meu cartão de crédito teve o limite reduzido de 1.35000 para 61500 contudo não avisado dentro do prazo estabelecido pelo banco central de 30 dias de antecedência.
Mercado Pago,minha divida era r 1.80000 e hoje está em r 3.35268 percebp que há juros acima da média do banco central na evolução da divida
Banco Bradesco,não consigo solicitar o empréstimo consignado que tenho margem disponível de 54505 mas não consigo solicitar pois a atendente disse que não há possibilidade para quem é negativado mesmo sendo um empréstimo consignado que será descontado direto da minha folha de pagamento.
Caixa Econômica Federal,sumiu da minha conta 407 reais tem dois desconto de pix que desconheço
Caixa Econômica Federal,tenho uma divida com a caixa e tenho o interesse de negociar. propuseram um pagamento de 2.10519 a vista para quitação dos dois contratos.
Nubank,realizei uma compra pelo aplicativo e cancelei minutos depois. após isso foi apenas dor de cabeça estavam me cobrando o valor que foi cancelado agora estão me cobrando juros dessa compra que foi cancelada.
Banco do Brasil,solicito o cancelamento da autorização de débito automático em conta corrente e em conta salário de qualquer tipo de operação realizada nesta instituição nos termos do art. 8º da resolução bacen nº 4.790 de 26 de março de 2020.
Banco Itaú Unibanco,em 20102024 verifiquei a o extrato scr na qual consta como prejuízo o valor de r 1.05718. ocorre que o valor é referente a 1 contrato cheque especial  lis que estava inadimplente entretanto foi negociado através do programa desenrola brasil. criado pela lei 14.690 de 2023 e já devidamente quitado. portanto não existe prejuízo ao credor.
Banco Santander,em 20102024 verifiquei a o extrato scr na qual consta como prejuízo o valor de r 2.52965. ocorre que o valor é referente 2 contratos que estavam inadimplentes com o banco santander entretanto ambos foram cedidos à crediativos. no mais 1 contrato foi pago e já se encontra liquidado e outro está em andamento com as parcelas devidamente pagas e sem atraso. portanto não existe prejuízo ao credor.
Banco Inter (Banco Intermedium),solicito a exclusão do meu nome do scr bacen
Nubank,gostaria de solicitar a exclusão do meu nome de scr bacen.
Nubank,quero tirar meu nome das instituições  pois meu nome consta com restrições peço que retire meu nome do banco central
