Empresa,Relato
Banco do Brasil,campo grandems 16 de outubro de 2024 venho através do site concumidor.gov.br peço a retitirada do meu nome da divida ativa ou seja do banco central bacem não consigo fazer movimentações nem mesmo fazer um consignado no meu trabalho sou funcionário público peço gentilmente q reetire o meu nome para q eu possa fazer consignado justamente para acertar essa pendência junto a instituição do banco brasil. também quero limpar o meu nome. att. juarez oliveira dos santos 67 9.xxxxxx649
Mercado Pago,meu cadastro foi suspenso e não consigo resolver. até o momento não me responderam porque foi suspenso. ja tentei diversas vezes tentar resolver o meu problema e ninguem consegue ver o que esta contecendo.
Banco Inter (Banco Intermedium),fazem meses que estou explicando que o valor que tá na folha do inss e uma e não site dela e uma divida maior eu nunca fiz nada pessoal só comsigando e no inss tá um valor no deles tá outro dias vezes o valoraior eu preciso de ajuda das autoridades
Caixa Econômica Federal,uma cobraça de juros absurdassendo que tento entrar em contatos com eles para facilitar a renegociaçao mais os juros sao abusivos
Banco do Brasil,fiz a renegociação do fies na agencia porem as parcelas não são fixas estão subindo muito outro problema que mesmo após a a renegociação ainda estou pagando as amortizações dos juros do financiamento. da forma como esta acontecendo será impossível cumprir com o acordo pois os valos ultrapassam o acordado. conta ag xxxxxx cc 18148x. numero do contrato 328210094
Banco Itaú Unibanco,não se sabe como mais nunca tive qualquer conta no itau e se tive garanto foi pagar
Nubank,não devo nada para nubank qualquer divida que tenha já foi paga. minha conta está até encerrada
Banco Itaú Unibanco,solicito que retirem meu nime dessa lista
Banco do Brasil,registrado favor retirar meu nome
Banco Bradesco,me chamo giovani da costa nóbrega júnior  eu ainda estou sendo perturbado pela empresa bradesco s.a a mais de 5 anos percebi meu nome no registrado velho fazer a reclamação para tirar meu nome do registrado
Mercado Pago,meu nome é eliel estou entrando em contatocom o procon por motivo de uma cobrança de uma dívida em um cartão de crédito do mercado pago eu entrei em contato com a empresa eles me disseram que eu tenho que pagar uma compra no mercado livre eu não tenho esse cartãode crédito alguém comprou no meu nome eu quero processar por danos moraes.
Banco Itaú Unibanco,já paguei e não tiram meu nome do prejuízo me lesando sobre serviço de crédito
Mercado Pago,falei várias vezes com o mercado pago desde setembro e não resolveram nada. dois atendentes somente foram eficientes e me disseram que iriam me reembolsar os r 5.000 reais que eu tentei pagar parcialmente a fatura do cartão apesar de não concordar com o valor. além disso o mercado pago está me cobrando mais de r 2000 em juros em cima dessa da fatura e resolveram parcelar o cartão de crédito em 8x virando uma fatura de mais de r3.00000 só de juros sendo que uma atendente ainda me ameaçou que o meu nome seria negativado se eu não pagasse. já falei com uns 10 atendentes e incrivelmente nenhum é da área e me passam para outro ou cai a comunicação da conversa. minha paciência já está no limite e só quero meu dinheiro de volta.
Banco do Brasil,solicito a imediata exclusão eou correção de dados cadastrados pelo banco do brasil sa no sistema de informações de crédito do banco central scr que atribuem ao meu histórico o registro de prejuízo em operações de crédito por mim contratado junto à instituição iniciei a renegociação do contrato em atraso com o banco visando ao adimplemento dessas operações. conforme o artigo 43 do código de defesa do consumidor lei 8.07890 no parágrafo 3 o consumidor sempre que encontrar inexatidão nos seus dados e cadastros poderá exigir sua imediata correção devendo o arquivista no prazo de cinco dias úteis comunicar a alteração aos eventuais destinatários das informações incorretas. além disso ainda conforme o parágrafo 5 do mesmo artigo consumada a prescrição relativa à cobrança de débitos do consumidor não serão fornecidas pelos respectivos sistemas de proteção ao crédito quaisquer informações que possam impedir ou dificultar novo acesso ao crédito junto aos fornecedores. ao deixar de excluir as informações negativas do scr o banco também deixa de atender ao disposto no artigo 5 da constituição federal que afirmam serem invioláveis a intimidade a vida privada a honra e a imagem das pessoas assegurado o direito a indenização pelo dano material ou moral decorrente de sua violação. diante do exposto reitero minha solicitação para que o banco do brasil sa proceda à imediata exclusão dessas informações negativas do
Caixa Econômica Federal,meu cartão de débito elo da caixa ence agora em outubro de 2024. o banco me enviou um novo cartão mas com a bandeira visa. entrei em contato com o sac da caixa solicitando um cartão com a bandeira elo mas o mesmo foi negado. protocolo xxx.xxx.xxxxx00540. peço o envio do cartão de débito com a bandeira elo. caso não seja possível o envio do mesmo peço o cancelamento da minha conta da caixa na agência 3216.
C6 Bank,olá na data de 16102024 recebi uma notificação de que o limite do meu cartão foi reduzido de r10.000 para r1.88553 zerando o limite disponível. sem aviso prévio sem notificação simplesmente foi feito. exijo explicações do porque isso foi feito sem aviso prévio sendo que sempre paguei em dia as contas do c6 bank. estou com dificuldades financeiras e o c6 era crucial na amortização das minhas dívidas e organização delas. sou cliente há mais de 2 anos já usei o platinum black carbon e indiquei vocês para inúmeros parentes e familiares devido aos benefícios tag sala vip. tenho conta pj com vocês onde movimento mais de r15000 por mês. tinha planos de usar as contas de investimentos e global de vocês.
Banco do Brasil,boa tarde sou laudicéia ricarte de morais ferreira cpf xxx.xxx.xxxxx conta poupança bloqueada saldo 5135
Banco Itaú Unibanco,no dia 11 de outubro de 2024  recebi um email do banco itaú unibanco com a seguinte mensagem oi leo boa tarde tudo bem é a mariana do itaú gerente de sua conta uniclass vamos renegociar consigo unificar todas as suas dívidas para quitação à vista no valor de r 4.58314. o que acha estamos dando 89 de desconto. obrigado atenciosamente mariana cuinas  cea. gerente de relacionamento. diante dessa proposta manifestei interesse por meio de uma resposta ao email. em seguida a negociação foi realizada via whatsapp do banco conforme o número informado no corpo do email whatsapp uniclass xxxxxx458. no dia 14 de outubro de 2024  por meio desse whatsapp a pessoa se comprometeu com mariana cuinas  minha gerente digital. questionei novamente sobre a quitação total das dívidas com a pergunta e eu zero tudo com vocês recebida como resposta sim porque é a quitação total de todas as dívidas. no entanto após dar o aceite o banco emitiu dois boletos diferentes um no valor de r 4.58874  conforme o acordo proposto e outro no valor de r 1.44189 . ao questionar o motivo da emissão de dois boletos fui informado que oi leo você tinha com o banco dois acordos feitos lá atrás que deixaram de pagar por isso foi gerado dois boletos dado um ser de cada acordo. considerando que a tratativa feita desde o envio do email até o óleo foi realizada de forma desleal e de máfé  pois a oferta inicial prometia a quitação total de todas as dívidas por um valor unificado sem qualquer menção a outras pendências. no entanto após a acessibilidade da oferta fui interessado com a emissão de um segundo boleto referente a uma suposta dívida adicional. dessa forma solicite que o banco cumpra uma proposta inicial de quitação de todas as dívidas pelo valor oferecido via email r 4.58314 e corrija a atuação de máfé praticada pelo gerente que transferiu a negociação. aguardo retorno urgente e uma solução adequada para a situação uma vez que o boletos vencem dia 18.10.2024.
Banco Inter (Banco Intermedium),eu tentei fazer acordo do valor total do cartão antes que a fatura ficasse atrasada porém não disponibilizaram para mim não compensava fazer o parcelamento da fatura novamente já que já tinha feito. agora que já está atrasada há alguns meses estão entrando em contato oferecendo acordo entretanto o valor que consigo pagar é somente parcelado e fazendo um parcelamento o valor de juros fica muito alto fica bem mais do que o valor da minha dívida o valor fica acima do valor do limite do cartão que foi de originalidade da dívida.
Mercado Pago,após o cancelamento de um produto comprado na amazon com pagamento realizado pelo cartão de crédito do mercado pago as parcelas dessa compra foram incluídas na fatura atual no valor de r15915. fui obrigado a pagar o valor integral devido ao fechamento da fatura. desde o dia 28 de setembro de 2024 não recebi o reembolso na fatura que fechou outubro nem na fatura atual novembro. tentei resolver a situação entrando em contato pelo whatsapp chat ticket e até mesmo por outros sites de reclamação mas não obtive mais respostas. além disso quando tento acessar o whatsapp novamente pelo menu do site ocorre um erro e sou orientado a tentar novamente.
Banco Inter (Banco Intermedium),mais uma vez estou tentando exercer o meu direito de requerer a portabilidade do meu contrato de empréstimo consignado negado pelo banco inter por 4 vezes sem nenhum motivo realmente comprovado e amparado por lei. após a abertura do último protocolo neste canal nº 2024.10xxx.xxx.xxxxx o banco inter informou que ao que se refere as requisições realizadas em 04072024 e 12072024 esclarecemos que não foram concluídas em razão de divergências identificadas nas informações do contrato.  eu tenho a cópia da requisição feita no sistema febraban e com ela é possível provar o nº do contrato informado. ademais ao que tange a requisição feita em 19072024 informamos que não foi concluída em razão de divergências identificadas nas informações do contrato sendo elas especificamente o saldo devedor de seu contrato informado incorretamente pela instituição proponente.  o saldo devedor muda diariamente com isso a instituição proponente preencheu um valor que cobria o saldo do banco inter como também posso provar através da cópia da requisição. já a 4ª solicitação feita em 29072024 que o o banco inter informa que não foi concluída pela instituição proponente foi autorizada pelo banco inter no último dia do prazo após o horário do expediente bancário ou seja a instituição proponente não pode fazer o pagamento do saldo devedor por estar fora do horário previsto para esse tipo de operações financeiras. essas 4 tentativas negadas e as justificativas apresentados pela ouvidoria do banco inter podem facilmente serem refutadas com as provas que tenho do sistema febraban que demonstram que as informações foram preenchidas de forma correta e que não há amparo legal para a retenção do meu contrato. além disso a 4º tentativa feita em 29072024 autorizada apenas na noite do último dia do prazo para a portabilidade que também pode ser comprovado demonstra a má fé do banco inter com a intenção de impossibilitar que o banco proponente concluísse a operação de portabilidade. além desses atos não me faltam provas de que o banco inter me negou mais de uma vez a gravação de minhas ligações além de negar me fornecer informações acerca da situação dos meus pedidos de portabilidade. o bacon inter até hoje é um dos únicos do brasil que não aderiu ao open finance dificultando ainda o acesso às minhas informações pessoais e financeiras na instituição.
Caixa Econômica Federal,eu havia uma divida do fies e essa divida foi paga a quase 3 meses e na data de hoje ainda consta no serasa . como já foi pedido ao gerente que abrisse um pedido de exclusao e ainda nao foi atendido
Caixa Econômica Federal,solicito a cópia dos contratos de empréstimo que fiz com a caixa.
Nubank,no dia 26 de setembro tive um bloqueio judicial em minha conta em razão de um processo ao qual já havia sido feito acordo tendo em vista que a divida já estava sendo paga e que os valores bloqueados se tratavam do meu salário conforme comprovado nos autos do processo rapidamente o juiz solicitou o desbloqueio e emitiu a ordem ao sisbajud. acontece que que todos os meus bancos já efetivaram o desbloqueio inclusive instituição financeira picpay que se equipara a nubank porém a nubank se nega fazer essa liberação. a nubank simplesmente está passando por cima de uma ordem judicial mesmo os atendentes da mesma informarem que a decisão do juiz já tinha sido colocada e vizualizada por eles no sistema sisbajud estou com passando necessidade e com minhas contas atrasadas em razão disso preciso um desbloqueio urgente pois o judiciario já solicitou a nubank já vizualizou o pedido conforme informado pelos seus proponentes e todas as demais instituições financeiras ao qual possuo já realizaram o desbloqueio estou tendo prejuizo de ordem moral em razão do descaso da nubank.
Banco Santander,empresa não fornecer boleto para pagamento.
Caixa Econômica Federal,gostaria de solicitar a retirada do meu nomes destas lista.
Nubank,solicito envio da cópia de meus contratos de empréstimos pessoais para meu email xxxxxxxxxxxxxxxx.xxx
Banco Santander,mesmo não querendo fazer o seguro eles colocaram de forma automática e agora que já cancelei minha conta ainda vem o valor exatamente desse seguro que nunca pedi.
C6 Bank,solicitei no site do valores a receber via bacen o valor de r 42300 no dia 1509 e até o momento não recebi nenhum retorno nenhum valor em conta sendo que tive a mesma demanda em outros 2 bancos e esses valores já caíram. enviei email para o xxxxxxxxxxxxxxxx.xxx porém sem retorno sem nenhuma ligação da instituição. no site do bacen conta que a instituição tem até 12 dias úteis para envio do recurso. já passou há muito tempo esse prazo. svr20240205.6233 protocolo
Banco do Brasil,divida antiga e sem motivos para o nome constar na lista de prejuizos do bacen.
Caixa Econômica Federal,atenção..... ler o arquivo república federativa do brasil estado do paraná foro regional de cambe comarca da região metropolitana de londrina serviço de registro de imóveis daniele michalowski cosechen registradora rua chile nº 315 sala cjardim vila rica cep xxxxxx10fone 43 xxxxxx853 email xxxxxxxxxxxxxxxx.xxx diligência registral n. 41832024. tem o presente a finalidade de solicitar a vossa senhoria a complementaçãoregularização dos itens abaixo relacionados com referência ao titulo apresentado para registroaverbação noa termos do art. 198 da lei 6.0151973. forma do título cancelamento de alienação fiduciária central eletrônica matricula nº 51.973  apresentante julia de carvalho gomes requerente julia de carvaleo gomes prenotação n. 254179 data para eventual devolução com exigência registral 17102024 data prevista para a prática do ato 11112024 data em que cessarão os efeitos da prenotação 11112024 o presente titulo é devolvido nesta data para atendimento das seguintes exigências 1 retificar termo de quitação apresentado uma vez que o registro a ser cancelado é o r697 da matricula nº 46014 atualmente averbado sob n 03 da matricula nº 51973. 2 efetuar o pagamento de r 17992 referente a complementação do valor dos emolumentos taxas incidentes para a prática de 01 cancelamento e selo em atenção ao artigo 14 da lei nº. 6.0151973. o pagamento poderá ser realizado presencialmente. na serventia ou mediante depósito bancário na conta banco do brasil ag. xxxxxx 00 45.xxxxxx titular daniele m. cosecher cpf xxx.xxx.xxxxx pix xxx.xxx.xxxxx. nota conata vinculado ao imóvel objeto deste documento protocolo n 254043 venda e compra. colocome à disposição de vossa senhoria para qualquer eventual atenciosamente esclarecimento. cambé 15 de outubro de 2024. escrevente am em recebi a 1ª via desta nota de devolução assinatura telefone 1. não se conformando com as exigências e interessado poderá requerer a suscitação de dúvida de acordo com o art. 198 da lei 6.0151973. 2. a prenotação do titulo garante a sua prioridade durante 20 dias que scrá cancelada decorrido o prazo se as exigências não forem atendidas. 3. após o cumprimento das exigências acima descritas poderá haver a solicitação de outros documentos para o efetivo registro pois o titulo passará por nova qualificação da qual poderá decorrer novas exigências
Caixa Econômica Federal,os registros de reclamaçãocontestações já foram efetuados nos canais de atendimento e também aqui. tive o cartão adicional roubado comuniquei imediatamente após ter ciência registrei contestações de 4 utilizações indevidas efetuadas com diferença de 1 minuto cada bloqueei e cancelei o cartão imediatamente. jamais ativeiutilizei aproximação com cartão. agora recebi sms falando que foram negadas as contestações citando uma cláusula 6a do contrato de prestação de serviços a qual é considerada abusiva pelo código do consumidor. a responsabilidade do fornecedor é objetiva. o artigo 14 do código de defesa do consumidor cdc estabelece que o fornecedor de serviços é responsável por reparar danos causados aos consumidores independentemente de culpa. art. 14. o fornecedor de serviços responde independentemente da existência de culpa pela reparação dos danos causados aos consumidores por defeitos relativos à prestação dos serviços bem como por informações insuficientes ou inadequadas sobre sua fruição e riscos. o art. 51 anula a tal cláusula 6a seção ii das cláusulas abusivas art. 51. são nulas de pleno direito entre outras as cláusulas contratuais relativas ao fornecimento de produtos e serviços que         i  impossibilitem exonerem ou atenuem a responsabilidade do fornecedor por vícios de qualquer natureza dos produtos e serviços ou impliquem renúncia ou disposição de direitos. nas relações de consumo entre o fornecedor e o consumidor pessoa jurídica a indenização poderá ser limitada em situações justificáveis ii  subtraiam ao consumidor a opção de reembolso da quantia já paga nos casos previstos neste código iii  transfiram responsabilidades a terceiros iv  estabeleçam obrigações consideradas iníquas abusivas que coloquem o consumidor em desvantagem exagerada ou sejam incompatíveis com a boafé ou a eqüidade vi  estabeleçam inversão do ônus da prova em prejuízo do consumidor vii  determinem a utilização compulsória de arbitragem etc etc etc pois bem a utilização indevida do cartão não se deu por senha pois o ladrão não a possuía. só pode ter se dado por aproximação a qual eu jamais ativei. se a caixa ativa esse serviço arbitrariamente tem que responder pelos danos causados. verifiquem no histórico de utilização do cartão que jamais anteriormente foi utilizada aproximação. agora eu pergunto quanto custa a hora do advogado de voces porque o prejuízo que vocês estão me trazendo custa 30900 utilizados por ladrão. o serviço de vocês não foi seguro eu nem sabia que a tal função aproximação era arbitrária pois nunca a ativei já veio ativada falha no serviço de vocês. vocês não têm o direito de impor isto ao consumidor. se eu quisesse teria ativado e utilizaria sempre mas nunca o fiz. se vocês não estornarem a cobrança de meu cartão vou ao procon. r30900 obtidos por serviço defeituoso alegando cláusula de contrato abusiva vale a hora do advogado de vocês
Banco Bradesco,prezado banco bradesco por meio deste requerimento solicito o cancelamento do débito automático em minha conta corrente conta xxxxxx agência 110 para não ocorrer mais descontos referente ao contrato n.º 503453434. além de cancelar o débito automático em relação ao contrato acima mencionado também solicito o cancelamento de quaisquer outras cobranças e descontos automáticos vinculados à minha conta corrente incluindo o cartão de crédito e o cheque especial associados a ela. devido a razões de ordem pessoal estou optando por encerrar o débito automático em minha conta bancária com a suspensão imediata desta funcionalidade. solicito portanto o cancelamento imediato desse serviço em minha conta corrente. notifico ainda que sejam adotadas as medidas necessárias para garantir que nenhum valor seja debitado automaticamente da minha conta bancária. esclareço que o pedido de cancelamento formulado nesta notificação encontra respaldo legal tem conformidade com os art. 6 e 9 da resolução 47902020 do bacen os quais garantem ao titular da conta o direito de cancelar a autorização de débitos automáticos. ainda existe tese fixada sobre o assunto pelo stj no julgamento do resp 1.863.973sp.
Nubank,em julho abri uma solicitação referente a um sinistro que ocorre na minha residência segue chamados br24033150  csp2bzxxxxxx9680 até agora não tive retorno. precisei pedir dinheiro emprestado para reforma minha residência pois estava sem energia e até agora nada do ressarcimento do valor. a empresa alega não ter informções suficientes para finalizar sendo que já enviei tudo.
Banco Inter (Banco Intermedium),usava o referido cartao de credito do banco há bastante tempo e no dia 15102024 fui fazer o pagamento no posto de gasolina pelo cartao de credito e foi negado após fui no supermercado e quando tentei pagar por duas vezes no caixa o cartao de credito tambem foi negado. no dia seguinte entrei em contato com o banco por meio do aplicativo prints anexos para saber o motivo e eles informaram que o cartao de credito foi cancelado sem previo aviso
Mercado Pago,ganhei um cupom de 15 reais off hoje que dá desconto em pagamento de conta acima de 40 reais . e foi tentar pagar uma conta que é mais de 170 reais e não está deixando pagar . segue print do cupom que ganhei hoje dia 1610
Banco Inter (Banco Intermedium),banco inter encerrou minha conta por desinteresse comercial sem me avisar previamente estou com saldo positivo e sem poder fazer movimentação tenho pensão que foi um acordo judicial vencido tenho aluguel contas básicas e alimentação tudo dependendo desse dinheiro.
Nubank,juros abusivos cobrança que eu. não. estou. devendo. no. cartão. devo. 800 reais cobrando. 1500
Banco Santander,no dia 20 de dezembro de 2022 o requerente recebeu uma ligação de uma promotora da vsr promotora ltda devido uma sondagem para um consignado avenida santos dumont sn 1º andar 1b centro turiaçu  ma cep 65.xxxxxx00 fone 98 xxxxxx750 feito no site do banco santander olé lhes apresentando uma proposta de consignado que seria em 36 parcelas de 41044 quatrocentos e dez e quarenta e quatro centavos no valor de 13.56076. treze mil quinhentos e sessenta reais e setenta e seis centavos. com mensagens temporárias avisaram para o requerente que o valor seria maior mas tinha prazo para aprovar só que iria ser resolvido. porem mandaram um roteiro que o requerente deveria seguir o que lhe deixou desconfiado mas foi convencido que tudo iria ser resolvido. seguindo o roteiro pelo requerente foi liberado o empréstimo da seguinte forma r 17.89706 dezessete mil oitocentos e noventa e sete reais e seis centavos onde pagaria 96 parcelas no valor de r 41044 quatrocentos e dez reais e quarenta e quatro centavos. a promotora de vendas da vrs entrou novamente em contato pedindo para que o requerente devolvesse a diferença que veio a mais no total de r 4.33630 quatro mil trezentos e trinta e seis reais e trinta centavos e lhe enviaram um boleto que era o modo de fazer a restituição. foi lhe informado que após a devolução da diferença seria atualizado no sistema e que o empréstimo ficaria em 36 parcelas de 41044 quatrocentos e dez e quarenta e quatro centavos. então agindo de boafé o requerente seguiu a orientação da promotora de vendas pagou o boleto restituindo assim o dinheiro ao banco. boleto print e áudio da conversa segue em anexo
Banco Santander,pessoas do santander ligando. toda hora cobrando. santander mandando juros abusivos não. e o. valor da minha dívida pra pagar
Banco Santander,em 092019 verifiquei a o extrato  cartão de crédito  conta corrente na qual constava cobrança do serviço indique o serviço cobrado exemplo seguro título de capitalização etc no valor 113314 cobrança que já transcreveu pelo tempo e período que no ano atual  não era para constar  necessito e solicito a exclusão para poder ter uma saúde financeira e poder obter credito  e trabalhar normalmente.
Caixa Econômica Federal,favor retirar divida do serasa. contrato já renegociado e com pendencia financeira em dia.
