Empresa,Relato
Mercado Pago,22102024 1617 ediules nova quest assessoria mercado pago prezados essa empresa acima citada tem me ligado incessantemente para falar sobre algo que não é meu. estão procurando o renô que é um conhecido mas não tenho nenhuma pendencia financeira com ele ou com o mercado pago. essa empresa me liga de 5 a 12 vezes por dia me atrapalhando no trabalho e no meu descanso. entrei em contato com o renô e pedi o cpf dele para que eu pudesse atender a ligação e falar com os mesmo para não me ligarem porém o educado atendente ediules desligou na minha cara antes mesmo que eu pudesse falar sobre isso as ligações no meu telefone são gravadas tenho dia horário nome tudo registrado. abro essa reclamação pois já bloqueei mais de 50 números e continuam me ligando deixo aqui manifestado que qualquer ligação a partir de hoje buscarei meios jurídicos para que isso não aconteça mais.
Nubank,ao pagar uma dívida com desconto o banco enviou meu nome pro scr como prejuízo e está me prejudicando a conseguir crédito. se o banco quis fazer acordo comigo não posso ser prejudicado segundo entendimento do stj. solicito a imediata retirado do meu nome sobe pena de ajuizar ação de indenização.
Banco do Brasil,consta no meu contrato de empréstimo consignado n 165.464 um seguro no valor de r 9.59532 o qual não contratei.
Banco do Brasil,venho apresentar a seguinte reclamação relativa ao descumprimento pelo banco do brasil da resolução bacen 91384 1 no dia 22112023 compareci à agência 1458 do banco do brasil solicitando o meu extrato do pasep referente ao período de 1976 a 2002. no mesmo dia recebi o extrato referente ao período de 1999 a 2002 tendo sido informado que os documentos anteriores a 1999 eram microfilmados e que eu deveria retornar no prazo de 60 dias para recebêlos. minha solicitação recebeu o número 22537250. 2 no dia 23012024 decorrido o prazo de 60 dias retornei à agência para receber os extratos e me foi informado que ainda não haviam sido prontificados e que eu deveria esperar mais 60 dias para recebêlos. 3 no dia 250320024 ou seja quatro meses após a minha solicitação inicial retornei novamente à agência para receber as imagens dos microfilmes. para minha surpresa me foi entregue a reprodução de apenas uma microficha referente ao ano de 1981. indaguei a funcionária do banco sobre a falta das microfichas dos demais anos porém ela me disse que aquela foi a única fornecida a partir de minha solicitação. 4 considerei que estava havendo omissão do banco na prestação de uma informação que eu tinha direito de possuir uma vez que de acordo com a resolução bacen 91384 é obrigatório que o banco mantenha dois microfilmes  permanecendo um no arquivo comum e outro no arquivo de segurança. logo se o banco não conseguiu acessar minha informações do pasep no arquivo comum deveria ter ido buscálas na cópia de seguramça. então retornei à agência no dia 07052024 e entreguei ao gerente uma petição requerendo que me fossem encaminhadas minhas informaçoes do pasep uma vez que o banco é obrigado a mantêlas e disponibilizálas quando solicitado. o gerente recebeu minha petição me informou que eu deveria retornar 120 dias depois a partir do dia 03092024 para receber as informações ou seja mais de dez meses depois da minha primeira solicitação. 5 retornei à agência do banco do brasil no dia 04092024 e novamente me foi entregue apenas a mesma imagem da microficha referente ao ano de 1981 que me havia sido entregue no dia 25032024. o funcionário da agência que me atendeu não conseguiu informar o motivo do não fornecimento de minha informações uma vez que o período de minha inscrição no pasep iniciou no ano de 1976 e permaneceu até o ano de 2002 pelo menos como consta do extrato que recebi referente ao período a partir de 1999.
Banco Itaú Unibanco,prezados conforme resolução nº 4.790 de 26 de março de 2020 capítulo iv solicito que seja definitivamente cancelada toda e qualquer autorização de desconto automático em conta de qualquer natureza salário corrente ou poupança. capítulo iv do cancelamento da autorização de débitos art. 6º é assegurado ao titular da conta o direito de cancelar a autorização de débitos. parágrafo único. o cancelamento da autorização de débitos em conta pode ser formalizado na instituição depositária ou por meio da instituição destinatária. para evitar maiores transtornos de conflito entre resoluções reforço que antes da vigência da resolução 47902020 tínhamos em plenos efeitos a resolução 36952009 que inclusive serviu como base para a resolução do ano de 2020 resolução bacen nº 3.695 de 26032009 art. 3º é vedada às instituições financeiras a realização de débitos em contas de depósitos sem prévia autorização do cliente.  1º a autorização referida no caput deve ser fornecida por escrito ou por meio eletrônico com estipulação de prazo de validade que poderá ser indeterminado admitida a sua previsão no próprio instrumento contratual de abertura da conta de depósitos.  2º o cancelamento da autorização referida no caput deve surtir efeito a partir da data definida pelo cliente ou na sua falta a partir da data do recebimento pela instituição financeira do pedido pertinente dessa forma desde 2009 temos resoluções do banco central do brasil que autorizam o cancelamento de débito automático em conta. portanto reforço que antes de qualquer negativa os senhores avaliem e remetam esse pedido às áreas superiores do banco e aqui reforço meu pedido solicito o cancelamento de todos os débitos automáticos realizados em minha conta corrente salário ou poupança referente a contratos firmados após o ano de 2009. solicito também por meio deste requerimento que todos os meus contratos de característica de crédito direto ao consumidor sem consignação em folha de pagamento tenham suas autorizações de débito em conta canceladas e que a partir da próxima parcela eu tenha o direito de pagar as referidas parcelas via boleto bancário ou diretamente na boca do caixa de qualquer agência da instituição.
Nubank,fiz um acordo para pagar a dívida em atraso porém o meu nome ainda está no registrato.
Banco Bradesco,boa tarde. venho através deste solicitar a 2via do meu contrato nº 1730631
C6 Bank,venho solicitar o ded  demonstrativo de evolução da dívia. no valor de r5118  contrato  emd900360427. e também solicito o ded  demonstrativo de evolução da dívia do cartão cartão c6 bank cartão de credito 5114 7700 0960 8803. obs cartão de crédito com limite via garantia de cdb aplicação financeira. nunca tive um limite disponibilizado pelo c6 e sim um limite onde o valor do limite era de 80 do valor do da minha aplicação financeira garantia real em cdb. o cartão foi liquidado com a baixa da aplicação. mesmo assim eles continuram me cobrando valores indevidos. favor me explicar pois nunca conseguiram explicar. e enviar ded  demonstrativo de evolução da dívia do cartão cartão c6 bank e ded  demonstrativo de evolução da dívia. no valor de r5118  contrato  emd900360427  está negativado.
C6 Bank,prezados boa tarde solicito o envio de todos os contratos existentes consignados empréstimos contratos abertura de conta ou qualquer outro junto à instituição financeira e seus respectivos extratos e evolução da dívida que estejam vinculados ao meu cpf. obrigada
Banco do Brasil,o sr. carlos danilo dos reis dias teve seu nome inserido na coluna de débito vencido no sistema de informações de crédito scr por uma dívida relativa aos bancos anexo  banco do brasil s.a. apesar de ter inadimplido o contrato estando por isso em mora no pagamento das prestações isso se deveu ao fato de ter sofrido crise financeira que a impossibilitou de honrar com suas dívidas. ocorre que o sr. carlos danilo dos reis dias não recebeu qualquer tipo de notificação prévia da parte ré no sentido de que seu nome e débito passariam a constar do sistema de informações de crédito scr como de uma pessoa devedora. a ausência de notificação mesmo na existência débito torna ilícita a negativação gerada no scr principalmente porque a parte autora sentiuse muito constrangida e abalada emocionalmente quando ao tentar efetivar uma compra no estabelecimento automobilistico não poder efetivar a compra por constar esta restrição no bacen. como é indevida essa anotação tentouse junto à parte ré a exclusão da negativação e a reparação do prejuízo extrapatrimonial decorrente desse ato ilícito porém não houve possibilidade de solução extrajudicial pela intransigência da demandada. diante disso deve ser reputada ilícita a anotação de prejuízo aqui questionada com a consequente determinação para que esse apontamento seja excluído do scr. ainda deve ser reconhecido o dever de a parte demandada reparar o prejuízo moral sofrido pela parte demandante decorrente da negativação indevida de seu nome. iii  do direito da restrição de crédito do scr e a inclusão indevida de informação como prejuízo o sistema de informações de créditos  scr instituído pela resolução cmn nº 3.65808 e atualmente regulamentado pela resolução cmn nº 4.57117 tem como uma de suas finalidades propiciar o intercâmbio de informações entre instituições financeiras conforme definido no  1º do art. 1º da lei complementar nº 10501 sobre o montante de responsabilidades de clientes em operações de crédito. art. 2º ii. a troca de informações entre instituições financeiras pode ocorrer durante o prazo de vinte e quatro meses de acordo com posição do banco central do brasil ...2  no caso das operações em atraso até quando elas aparecem no scr quando uma operação completa 60 meses em atraso o banco realiza um registro no sistema de forma que ela deixa de aparecer para todos os meses sob consulta. porém ela continua aparecendo nos sistemas internos do banco onde consta a dívida. já as outras instituições que não são credoras dessa operação somente podem consultar as informações consolidadas dos últimos 24 meses. disponível em httpswww.bcb.gov.bracessoinformacaoperguntasfrequentesrespostasfaq_scr. e por esta razão solicitamos a imediata exclusão da notificação registrato do banco central como em prejuízo.
Nubank,preciso que o banco nu retire imediatamente meu nome da restrição do banco central.
Nubank,conforme decisão do stj dívidas com mais de 5 anos não podem ser mais cobradas. solicito que deem baixa das dívidas que aparecem no meu nome lá no site do serasa
Banco Inter (Banco Intermedium),desde o dia 25 de setembro de 2024 estou tentando realizar o parcelamento da fatura do meu cartão de crédito conforme indicado no aplicativo do banco inter. no entanto após diversas tentativas a negociação não foi concluída. tentei resolver o problema de várias maneiras pelo aplicativo pelo computador e por meio de contato telefônico mas sem sucesso. no dia 22 de outubro de 2024 entrei em contato com o atendimento telefônico do banco às 1532 protocolo xxx.xxx.xxxxx008 atendente luana porém a atendente não soube fornecer informações essenciais para a conclusão da negociaçãoparcelamento do débito. ela também encontrou dificuldades para explicar as taxas e impostos aplicáveis. solicitei falar com um supervisor ou gerente mas fui informado que isso seria impossível. a atendente tentou novamente explicar o valor final da dívida parcelada mas após pedir que eu aguardasse em linha a ligação foi transferida e caiu sem aviso. novamente entrei em contato por telefone às 1551 no mesmo dia solicitando ser atendido pela advisorgerente vitória conforme consta no meu aplicativo. fui inicialmente atendido por kézia que me informou que o protocolo seria enviado por email o que não ocorreu. além disso fui informado que a advisor vitória estava em reunião e não poderia me atender. foi feito um agendamento com a promessa de que a própria vitória entraria em contato o que ainda não aconteceu. estou enfrentando grandes dificuldades para resolver a questão mesmo demonstrando interesse em negociar e regularizar o débito. solicito portanto o auxílio desta plataforma para que o banco resolva a situação sem a aplicação de juros pelo período visto que a mora foi causada exclusivamente por falhas no atendimento do banco. é injusto que esses encargos sejam cobrados de mim cliente já que a impossibilidade de negociação é responsabilidade da instituição.
Banco do Brasil,eu já efetuei o pagamento da dívida no valor que foi sugerido pelo banco mas meu nome esta constando na lista de restrição dos bancos gostaria que fosse retirado.
Nubank,dívida já foi paga e meu nome aparece como prejuízo no registrato sendo que era um cartão com limite igual ao investimento dívida já paga ainda sujaram meu nome.
C6 Bank,eu já efetuei o pagamento da dívida mas meu nome esta constando na lista de restrição dos bancos gostaria que fosse retirado.
Nubank,prezados venho através deste registro deixar documentado que estou com total impossibilidade de arcar com todas as dívidas que possuo nessa instituição sem comprometer o mínimo para minha subsistência.
Banco do Brasil,prezados conforme comunicado de superendividamento enviado em demanda aberta anteriormente sob protocolo n 2024165796 venho através deste formalizar minha solicitação de renegociação de dívidas diretamente pelo procon e bacen uma vez que não obtive êxito em nenhuma das conversas via telefone e pela agência onde somente me foi oferecido valores que não tenho condições alguma de pagar diante do meu cenário de superendividamento tenho tentado reiteradamente e sucessivamente diversas tentativas de contato com o banco para renegociar essa dívida e em resposta só recebo propostas com juros abusivos e que aumentam muito o valor da minha dívida. estou em um complexo processo de reorganização financeira e tenho me esforçado para colocar minhas obrigações em dia mas preciso ter um canal de comunicação com o banco que me apresente uma proposta justa e sem juros exorbitantes. considerando o valor do capital emprestado e o valor que já paguei venho oferecer uma proposta de r 25.00000 para pagamento do cdc salário que ainda está pendente com esse banco em 24x104160. me coloco a disposição para receber uma contraproposta mas de fato não consigo assumir um valor acima do proposto pois como informei no comunicado anterior hoje no sistema de informações de crédito do banco central  scr minha responsabilidade total em reais é de r 456.90728 em 4 bancos e instituições financeiras. caso seja necessário posso enviar a vocês meu comprovante de pagamento e rendimentos mensais junto com a comprovação de toda minha movimentação financeira onde pago minhas necessidades básicas uma relação de todas as minhas dívidas que são com garantia e sem garantia e também um descritivo detalhado de minhas despesas essenciais mensais pois desde que constatei a minha situação de superendividamento toda minha movimentação está em uma única conta e do mesmo modo que estou encaminhando esse pedido a vocês estou encaminhando para todos os meus credores de outras instituições e não tenho absolutamente nada a esconder ou ocultar. certo da cooperação dessa instituição no seu papel na prevenção e tratamento do superendividamento aguardo retorno por escrito a fim de mantermos o registro das interações entre nós. data 22102024 nome amélia duarte bezerra cpf xxx.xxx.xxxxx
Mercado Pago,olá mercado pago eu tenho uma maquina cadastrada do ercad pag em meu nome e fui fazer um teste na maquina hoje com o meu cartao de debito e o pagamento deu recusado por 3 vezes  porem mesmo constado na movimentaç da minha conta mercado pago como recusado pelo banco . o valor consta como debitado na minha conta caixa n.
Banco Itaú Unibanco,prezados venho através deste registro deixar documentado que estou com total impossibilidade de arcar com todas as dívidas que possuo nessa instituição sem comprometer o mínimo para minha subsistência.
Banco Bradesco,boa tarde ja fiz reclamação e mencionei que não agencia na minha cidade. e muito menos consigo ter acesso aos documentos no aplicativo. então veio nada nos email. então encaminhar a documentação por este canal
Banco Itaú Unibanco,negativaçao por divida ja pagar ao banco
Mercado Pago,olá recebi a oferta de liberação de um cupom no valor de r 2800 para pagamento de conta acima de r 3000 ao cadastrar minha chave pix celular ou cpf. pois bem realizei o cadastro dentro do prazo e a empresa disponibilizou o cupom no dia 20102024 para uso no prazo de 3 dias. entretanto para minha surpresa hoje dia 22102024 o cupom já não estava mais disponível. diante disso entrei em contato com o sac relatando o ocorrido e fui informada que devido a uma indisponibilidade no sistema não seria possível eu utilizar o cupom. e para piorar sendo o cupom do mercado pago tiveram a audácia de me oferecer um cupom de 20 para compra de produtos selecionados no mercado livre. ou seja reconheceram o erro visto que no mínimo o cupom ainda deveria funcionar na data de hoje pois tratase de dias e não horas conforme constante no regulamento não resolveram o problema e ainda abusaram da minha cara. uma tremenda falta de respeito e consideração com o cliente vindo de uma empresa desse tamanho. não se trata de valor de cupom ou promoção o pior é a falta de respeito e abuso no tratamento ao cliente. não entendo porque a empresa oferta esse tipo de promoção se não tem o minimo interesse em cumprila. e agora com agravante abusam na nossa cara mesmo reconhecendo estar errada e a cliente certa. sintome envergonhada com essa atitude. seguem anexos os prints para com o erro da empresa.
Nubank,boa tarde no ano de 2021 eu tinha o cartão na função crédito porém meu limite era muito baixo então eu decidi cancelar a função crédito porém agora desejo ter a função liberada novamente só que o banco não faz uma nova analise para liberação do limite há tempos que eu venho tentando via atendimento no chat porém nada acontece inclusive ate recebi convites de amigos para ter novamente o cartão mais quando clico no link ja abre o aplicativo e também nada acontece e não existe empecilio para ter o cartão novamente
Banco Santander,abri uma conta santander dia 20102024 eu queria a conta free santander..... me abriram a select. nao quero essa conta ate pq. nao oferece absolutamente nada mais que a free.
Mercado Pago,a empresa mercado livre não possui canal de reclamação direta havendo somente a possibilidade de realizar reclamação pelo reclame aqui. no reclame aqui foi exposto que os dados do cadastro da empresa foi indexado os dados pessoais do antigo gestor. devido essa falha a empresa ao tentar obter o acesso a conta perante ao mercado livre é obstaculizada porque somente é possível acesso após o método de verificação por sms ou whatsapp. justamente são esses métodos que se encontram cadastrados com os dados do antigo gestor. vale ressaltar que anteriormente foi tentado o acesso ao conta com a verificação facial para testar ser o sócio da empresa.
Banco do Brasil,prezados conforme resolução nº 4.790 de 26 de março de 2020 capítulo iv solicito que seja definitivamente cancelada toda e qualquer autorização de desconto automático em conta de qualquer natureza salário corrente ou poupança. capítulo iv do cancelamento da autorização de débitos art. 6º é assegurado ao titular da conta o direito de cancelar a autorização de débitos. parágrafo único. o cancelamento da autorização de débitos em conta pode ser formalizado na instituição depositária ou por meio da instituição destinatária. para evitar maiores transtornos de conflito entre resoluções reforço que antes da vigência da resolução 47902020 tínhamos em plenos efeitos a resolução 36952009 que inclusive serviu como base para a resolução do ano de 2020 resolução bacen nº 3.695 de 26032009 art. 3º é vedada às instituições financeiras a realização de débitos em contas de depósitos sem prévia autorização do cliente.  1º a autorização referida no caput deve ser fornecida por escrito ou por meio eletrônico com estipulação de prazo de validade que poderá ser indeterminado admitida a sua previsão no próprio instrumento contratual de abertura da conta de depósitos.  2º o cancelamento da autorização referida no caput deve surtir efeito a partir da data definida pelo cliente ou na sua falta a partir da data do recebimento pela instituição financeira do pedido pertinente dessa forma desde 2009 temos resoluções do banco central do brasil que autorizam o cancelamento de débito automático em conta. portanto reforço que antes de qualquer negativa os senhores avaliem e remetam esse pedido às áreas superiores do banco e aqui reforço meu pedido solicito o cancelamento de todos os débitos automáticos realizados em minha conta corrente salário ou poupança referente a contratos firmados após o ano de 2009. solicito também por meio deste requerimento que todos os meus contratos de característica de crédito direto ao consumidor sem consignação em folha de pagamento tenham suas autorizações de débito em conta canceladas e que a partir da próxima parcela eu tenha o direito de pagar as referidas parcelas via boleto bancário ou diretamente na boca do caixa de qualquer agência da instituição. é do meu conhecimento que apesar das incontáveis decisões judiciais que garantem esse direito ao consumidor os bancos negam tal solicitação então quero reforçar que tenho pleno conhecimento da existência da resolução n.º 4790 do bacen da resolução nº 3.695 de 26032009 e que a qualquer tempo posso cancelar uma solicitação anterior de autorização de débito em conta. reforço que também estou ciente da existência do código de defesa do consumidor inciso iv do artigo 51 do cdc que dispõe serem nulas de pleno direito as cláusulas contratuais relativas ao fornecimento de produtos e serviços que estabeleçam obrigações consideradas iníquas abusivas ou que coloquem o consumidor em desvantagem exage
C6 Bank,olá tentei contatos através do chat referente a conta corrente mei de cnpj 42.105.402xxxxxx9 mas é impossível seguir para um atendimento humanizado então o único caminhos seguirá por aqui. realizei a transferência para pagar o especial que estava pendente de regularização realizei o pagamento de todas as pendencias e solicitei o cancelamento da conta e mesmo assim vocês não enviaram a solicitação de baixa junto aos órgãos de proteção ao credito de meu cpf.
Banco Santander,prezados aumentaram o limite do meu cartão de crédito sem a minha permissão. gostaria que o valor ficasse em 6.00000 e não em 18.900 como está. solicito que entrem em contato comigo pois não consigo ter acesso ao way aproveito para deixar registrado o quanto não é intuitivo o uso dos aplicativos que pedem senhas que não sabemos onde encontrar e nem onde a obter.
Caixa Econômica Federal,boa tarde tive uma demissão por justa causa porém foi convertida em demissão sem justa causa judicialmente a empresa me passou toda papelada para o saque do meu fgts porém não obtive sucesso na data solicitada sendo no dia 04102024 ao ir ao banco me informaram que meu saque aniversário estava ativo que ocorreria um prazo para atualizar e que não seria possível o saque naquele momento que eu teria que aguardar por 10 dias então aguardei ao retornar ao banco depois do prazo informado me falaram que ainda não estava liberado e fui diversas vezes depois disso perdendo tempo e esperando diversas horas para ser atendido e ainda sem sucesso. funcionários do banco não sabem explicar o que está acontecendo só diz que não está liberado e somente. lembrando que hoje já é 22102024. inadmissível toda essa espera então peço encarecidamente a resolução deste problema para o saque deste fgts. toda essa questão está me prejudicando tanto em tempo quanto nos meus compromissos feitos com o comprometimento deste dinheiro a não resolução imediata desta situação ocasionará em uma resolução judicial com todos os meus direitos. aguardando.
Nubank,resumindo fiz duas compras no mercadolivre cancelei o mercadolivre concordou com o cancelamento enviou os comprovantes do cancelamento inclusive com uma mensagem via reclame aqui com a concordância como estava demorando o estorno fiz uma contestação no nubank pra minha surpresa o nubank arquivou a contestação argumentando que o mercadolivre se recusou a fazer o reembolsoo que é uma piada já que todos os comprovantes foram anexados a contestação onde o mercadolivre não só atestamas escreve por escrito concordando com a devolução enfim sou cliente ultravioleta e tenho gastos mensais em torno de r 2.00000caso o nubank não resolva esse erro absurdo não farei mais compras no cartão e se me aborrecer muito vou encerrar minha conta e obviamente apesar do valor baixo irei recorrer ao judiciário.
Banco Itaú Unibanco,fiz uma negociação para pagamento da utilização de limite de cheque especial porém em apenas 8 parcelas os juros cobrados foram de mais de 20 da dívida. bem como houveram mais taxas sendo cobradas após o aceite de um acordo para a isenção de taxas na conta.
