Empresa,Relato
Banco Inter (Banco Intermedium),está sendo cobrado pelo banco intermedium em meu contracheque vários valores mês sim e mês não sendo constando 0187 prestações conforme contrato 10587640 peço cópia do contrato pois realizo contato telefônico com o banco inter e eles não localiza o referido contrato e dizem que não possuo conta e empréstimo com o referido banco.
Banco do Brasil,solicitei cheque especial em minha conta e fui informado que estou em um cadastro de inadimplentes com o banco por uma divida da loja de minha esposa que foi quitada a muito tempo com desconto oferecido por eles. nunca tive participação societaria nessa empresa diz o nanco que estou nesse cadastro de inadimplente por eu ser casado e se caso quizer resolver a situação preciso pedir a atualização dos valores que foi pago se não me engano mais ou menos em 2009.
Banco Inter (Banco Intermedium),foi apresentada uma proposta para quitação da divida mas ficou fora das minhas possibilidades.
Caixa Econômica Federal,em 24102024 verifiquei a o extrato  cartão de crédito  conta corrente na qual constava cobrança do cartão de credito no valor 7.17230 que por mim não é reconhecido pois ja tentei acordar para diminuição de juross abusivos e não obtive retorno sendo que essa fatura havia uma compra contestada so quero pagar o valor justo
Banco Itaú Unibanco,solicitei ao banco uma negociação da dívida onde consigo pagar pois estou desempregado. mas o banco enviou uma proposta com juros abusivos.
Banco do Brasil,em 24102024 verifiquei a o extrato da conta na qual constava cobrança do empréstimo cobrado no valor de r14.74461 que por mim não é reconhecido pois eu não solicitei e não autorizei a contratei algo desse valor.
Banco Inter (Banco Intermedium),surreal que eu precise dizer isso mas vcs gostam do caminho fácil de responder sem ler se tivessem lido se soubessem ler veriam que foi dado resposta sem nenhuma relação com o problema mencionado. e que não tem relação com a esfera judicial ainda. recebi um email da empresa no dia 2710 dizendo que minha conta está com saldo negativo mas a conta está bloqueada e não tenho acesso ao saldo da conta entrei no atendimento às 1924 e não tive resposta mesmo o horário de funcionamento do chat sendo até as 2000 e o banco estava recusando transferências. qualquer consequencia disso é anulada como encargos que foram cobrados e tornou a conta negativa mais uma vez. que bom que no protocolo anterior esclareceram que foram cobrados juros e multa pelo período em que a conta estava negativa e bloqueada é uma evidencia judicial essencial das práticas abusivas desse banco.
Banco Santander,estive em uma agencia santander para solicitar que retirem meu nome da lista de prejuizo bancario
Nubank,entrei em contato para tentar uma renegociação da dívida para quitalá. o atentende ofereceu uma proposta identica a que esta disponivel no aplicativo como o valor esta muito elevado e também estou negociando com outras instituições não foi possivel chegar em um acordo
Nubank,não consigo pagar a fatura do cartão de crédito devido tantos juros acumulados
C6 Bank,em 24102024 recebi uma ligação através do whatsapp do número xxxxxx879 alegando ter feito um a transação via pix erradamente para a minha chave pix referente a conta corrente do c6 bank. em seguida verifiquei que havia o crédito de 1.00000 reais na minha conta vindo da plataforma one pay meios de pagamentos. na ligação a mulher alegou necessitar do dinheiro e pediu para que eu realizasse a transferência para outra chave pix que não a de origem do dinheiro  cpf xxx.xxx.xxxxx.isis de cassia de jesus pedro. sem saber da existência de um golpe nesses moldes e no meio do meu trabalho na gestão de uma escola pública do rio de janeiro não me atentei em verificar se estava caindo em um golpe e realizei o pix conforme foi solicitado. na manhã seguinte realizei a comunicação de ocorrência nxxxxxx16642024 após entrar em contato com o banco c6 bank através do app que tenho acesso a conta. ressalto que o banco não retornou com as medidas que enviaria através de email e nenhum outro contato. gostaria que houvesse uma intervenção para que eu não tenha meu cpf danificado pois sou gestora de uma unidade escolar e mexo diretamente com contas públicas. gostaria de uma resposta o mais breve possível.
Nubank,na data 2410 vi juros abusivo 2.73476 eu estou afastada do trabalho a um ano e é 8 meses sem pagamento estou pelo inss sem pagamento mal posso comprar meus remédios eles ligam me ameaça peço que limpa meu nome
Banco Bradesco,solicito que seja retirado o débito automatico da minha conta corrente n xxxxxx agencia nº3563 referente ao débito da minha parcela do meu contrato de empréstimo consignado nº 481942502.
Mercado Pago,fiz uma compra no mercado livre dia 1210 foi confirmado o reembolso mais e fui informado pelo atendente do mercado pago que iria receber dia 2210 mas nunca recebi o reembolso. simplesmente horrível esse sistema do mercado pago. antes mostrava a data que eu ia receber meu dinheiro agora não sabemos de nada. invés de melhorar as empresas so piora por isso perde clientes. vai mexer em algo que bom e transforma em ruim. coloquem como estava antigamente o reembolso que o cliente via a data que ia receber o reembolso.
Banco do Brasil,prezados conforme resolução nº 4.790 de 26 de março de 2020 capítulo iv solicito que seja definitivamente cancelada toda e qualquer autorização de desconto automático em conta de qualquer natureza salário corrente ou poupança. capítulo iv do cancelamento da autorização de débitos art. 6º é assegurado ao titular da conta o direito de cancelar a autorização de débitos. parágrafo único. o cancelamento da autorização de débitos em conta pode ser formalizado na instituição depositária ou por meio da instituição destinatária. para evitar maiores transtornos de conflito entre resoluções reforço que antes da vigência da resolução 47902020 tínhamos em plenos efeitos a resolução 36952009 que inclusive serviu como base para a resolução do ano de 2020 resolução bacen nº 3.695 de 26032009 art. 3º é vedada às instituições financeiras a realização de débitos em contas de depósitos sem prévia autorização do cliente.  1º a autorização referida no caput deve ser fornecida por escrito ou por meio eletrônico com estipulação de prazo de validade que poderá ser indeterminado admitida a sua previsão no próprio instrumento contratual de abertura da conta de depósitos.  2º o cancelamento da autorização referida no caput deve surtir efeito a partir da data definida pelo cliente ou na sua falta a partir da data do recebimento pela instituição financeira do pedido pertinente dessa forma desde 2009 temos resoluções do banco central do brasil que autorizam o cancelamento de débito automático em conta. portanto reforço que antes de qualquer negativa os senhores avaliem e remetam esse pedido às áreas superiores do banco e aqui reforço meu pedido solicito o cancelamento de todos os débitos automáticos realizados em minha conta corrente salário ou poupança referente a contratos firmados após o ano de 2009. solicito também por meio deste requerimento que todos os meus contratos de característica de crédito direto ao consumidor sem consignação em folha de pagamento tenham suas autorizações de débito em conta canceladas e que a partir da próxima parcela eu tenha o direito de pagar as referidas parcelas via boleto bancário ou diretamente na boca do caixa de qualquer agência da instituição.
Nubank,a instituição financeira nubank realizou a inclusão do meu nome no registrato alegando prejuízo dos valores contudo tal valor foi devidamente pago em acordo realizado junto ao serasa consumidor. os comprovantes de pagamentos foram enviados para a instituição financeira todavia até a presente data não realizaram a retirada no meu nome do registrato vindo a me causar sérios prejuízos.
Banco Itaú Unibanco,paguei uma dívida em 2021 no banco itaú e tirei um relatório e consta em prejuízo no scr e isso esta me prejudicando a conseguir credito. se o banco quis fazer o acordo comigo não posso ser prejudicada segundo entendimento do stj.
Nubank,estou com uma dívida no cartão de crédito na empresa nubank porém não consegui pagar devido aos juros serem muito altos.
Banco do Brasil,recebi um consócio cedente de adesão número 4.400.735 cota número 9.384 no mês de agosto de 2024 onde ao iniciar o processo foi perguntado diversas vezes ao atendente cláudio qual era o valor de transferência de consórcio. o mesmo diversas vezes respondeu que não exisitia valor de transferência de correntista bb para conrrentista bb. ao assinar o contrato memento nenhum consta essa informação de valor de transferência e no dia 10 de outubro ao pagar a primeira prestação do consórcio fui surpreendido com o valor a mais do que o contratado. ao ligar para o bb na parte de consórcios foi informado pela atendente que esse valor se referia a taxa de transferência do consórcio. informei pra ela que durante o processo de transferência tinha sido informado para mim que não teria taxa porém a mesma disse que o que constava no sistema era aquela informação e que não poderia fazer infelizmente nada pois ali só conseguia dizer o que estava sendo cobrado. perguntei o que deveria fazer e ela me informou que deveria procurar a agência. procurei a agência e lá o atendente não soube me dizer se tinha ou não taxa de transferência e que se no atendimento por telefone foi falado é por que exisitia. resumindo saí de lá sem resolução do problema e com um valor de quase mil reais descontados como taxa de trasnferência.
Banco do Brasil,em 2410 verifiquei a o extrato eu não autorizei nenhum dados meus vazados eu estou doente pelo inss há um ano 8 meses sem pagamento estou afastada por motivos de doença peço limpeza do meu nome.
Caixa Econômica Federal,1  sou beneficiária do inss por tempo de contribuição nb nº. 138.234.xxxxxx. 2.  em consulta ao extrato de empréstimo consignado constatei o desconto de r 27867 denominado consignação empréstimo bancário. 3.  ocorre que não foi disponibilizado cópia do contrato informando valor emprestado e juros aplicados.
Caixa Econômica Federal,boa tarde tentei solicitar pelo aplicativo de habitação sobre um financiamento que tinha com a instituíção porem ate o presente momento não consegui essa informação.
Banco Bradesco,paguei uma dívida com desconto e o banco colocou meu nome no prejuízo do banco central. segundo o stj essa lista tem caráter restritivo de credito devendo o banco remover o nome da lista sob risco de processo judicial pedindo a retirada e danos morais. ao tentar fazer um financiamento de imóvel em outro banco o retorno da instituição financeira foi que proponente possui dívidas baixadas como prejuízo no scr.
Banco do Brasil,fui vítima de uma fraude para a qual fiz um lançamento de pix assim que percebi entrei em contato com o banco e contestei o lançamento mas a contestação não foi aceita. a pessoa alegou ser atendente da minha empresa de internet e gerou m suposto código de reembolso que era na verdade um código de pagamento pix como eu disse no atendimento ao final do código gerado havia a inscrição claroestornodepagamento utilizada para justificar o suposto reembolso
Nubank,abri um conta na nubank mim enviaram cartão de crédito gastei no cartão depositei a quantia para pagar a fatura do cartão porem sem motivo a nubank bloqueio minha conta e os valores lá depositado agora estão cobrando a conta do cartão e juros porem tenho valores bloqueados no aplicativo da nubank tal valores seria utilizado para pagamento da fatura do cartão de crédito já pedi varias vezes a devolução dos valores bloqueados justamente para pagamento da fatura porem nunca fui ressarcido e fatura do cartão só vem aumentando de valor devido os juros e multas.
Banco do Brasil,título da reclamação solicitação de retirada do nome do rcq do bacen descriçãosolicito retirada dos meu dados sobre dividas visto que existe um periodo de mais de 5 anos. prezadosbanco do brasil gostaria de registrar uma reclamação referente à inclusão do meu nome no registro de clientes do banco central rcq. eu chrystian emanoel chaib ferreira portadora do cpf nº xxx.xxx.xxxxx realizei uma solicitação formal para a exclusão dos meus dados uma vez que exerço meu direito à privacidade e proteção de dados pessoais. no entanto até o momento não obtive resposta ou confirmação sobre a efetivação dessa solicitação. reitero que a manutenção do meu nome no rcq é inadequada e gostaria que essa situação fosse resolvida o mais breve possível. aguardo uma posição a respeito e agradeço pela atenção. atenciosamente chrystian emanoel chaib ferreira xxxxxxxxxxxxxxxx.xxx 98 xxxxxx258
Banco Inter (Banco Intermedium),primorosos boa tarde. como estão infelizmente estou passando por um problema que já vem se encaminhando para quase 1 ano. no dia 02012024 havia solicitado o cancelamento da minha conta corrente logo após em 04012024 recebi o devido email informando que de fato haviam cancelado minha conta. acontece que me arrependi dessa decisão e queria novamente o acesso de minha conta aguardei o prazo de 180 dias para abertura de uma nova conta e em 19082024 entrei em contato para a devida finalidade pois não estava conseguindo pelo aplicativo e para minha surpresa fui informado que a conta nunca tinha sido cancelada pois havia valores nela para serem resgatados tinha sido somente suspensa. então o atendente me disse que faria a reativação bem como a limpeza dos meus dados da conta para usala normalmente desde então o problema persiste entro em contato e pedem para aguardar 5 dias úteis que entrarão em contato nínguem entra novamente ligo e a nova atendente me diz a mesma coisa aguardo mais nada acontece. por fim em 09102024 consegui o acesso pois pediram para retirar o valor de minha conta para a mesma ser reativada fiz a remoção do valor e recebi outros 2 emails. o primeiro falando que a conta havia sido encerrada e o 2 falando que tinham feito alguns procedimento internos e que habilitaram para eu abrir um nova conta porém não consigo já fiz de tudo mas o aplicativo mostra que essa minha conta aparentemente ainda consta suspensa não consigo alterar senha e nem criar uma nova conta menciono ainda que o aplicativo e sistema ios 18.0.1 estão devidamente atualizados.
Banco Bradesco,quando correntista do banco bradesco fiz 02 contratos de emprestimo pessoal e os quitei no programa desenrola contudo o banco apresenta mais 03 contratos diversos dos quais 01 dele esta negativado e 02 em protesto no 05º cartorio de protesto da cidade de manaus.
Banco Bradesco,recebi uma ligação com nome do banco bradesco onde tenho conta a pessoa do outro lado falava que era gerente do banco e que tinha um iphone tentando fazer um empréstimo em minha conta e para bloquear ele eu precisava apagar e baixar novamente meu aplicativo do banco então falei que ia ligar para minha gerente e ele falou que ela estava ali e me passou para uma mulher que falava igual minha gerente de conta e essa mulher falou para eu olhar minha conta quando olhei a conta já tinha o empréstimo feito e ela falou que para ser cancelado o empréstimo eu precisava devolver o dinheiro para a caixa económica ela foi fazendo as simulações e quando olhei minha conta eles tinham feito dois empréstimos um no valor de 25.43637 e transferiu o exato valor com uma ted para uma pessoa chamada kaic da veiga santos e outro empréstimo no valor de 16.00000 e transferiu com pix para ingrid cristina moura e fez mais um pix de 2.94699 para a mesma registro ocorrências policiais protocolo 2024 1023 2351 075
Caixa Econômica Federal,paguei o boleto do fies referente 11112024 no dia 22102024 no aplicado do fies o saldo devedor era de 1.500 e alguns centavos porém um dia após o saldo ao invés de abater subiu para 1.601 32. nenhum dos atendentes conseguiram me explicar o que aconteceu. conversei ontem no sac da caixa com o davison e ele disse que no sistema já constava o meu pagamento e que o valor era de 1.27040 e que o valor mudaria mas até o momento ainda está em 1.60135. gostaria de uma solução pois não tenho condições de pagar a mais
Banco Itaú Unibanco,prezados venho por meio deste solicitar a retirada do meu nome do registrato. recentemente ao consultar meu extrato no registrato identifiquei a presença de registros de operações que já foram devidamente liquidadas e que não condizem com minha atual situação financeira.esses registros estão causando transtornos indevidos e afetando negativamente minha análise de crédito junto a instituições financeiras estando em dia.solicito que seja realizado uma revisão completa desses registros  e que os dados sejam atualizados de forma a refletir com precisão a minha situação financeira atual.peço ainda que esta solicitação seja tratada com urgência para evitar maiores danos e transtorno. estou à disposição para fornecer qualquer documentação adicional que seja necessária para o processamento desta reclamação .  agradeço a atenção e aguardo um retorno o mais breve possível. dados pessoais nome completo cilsa aparecida de sousa crecencio  cpf 627.535.091.15 endereço avenida fortaleza bairro jardim bem viver telefone 66 992355924 e mail xxxxxxxxxxxxxxxx.xxx
Banco Bradesco,realizei um empréstimo de 20.000 e o juros está muito abusivo quando eu terminar de pagar vou estar pagando quase 100 mil tem dois meses que eu não consegui mais tá pagando a prestação de 198273 gostaria de rever os jurosrealizei o pagamento de 9 prestações foram feitas 48 paguei um valor de r 17.845 ou me ajudar por favor.
Caixa Econômica Federal,eu possuo vínculo com a caixa econômica federal por meio de um contrato de financiamento no valor de r66.18361 com parcelas de r1.3149 firmado em 13112023. na ocasião o banco teve acesso ao holerite para realizar análise de crédito mas desconsiderou que o valor apontado me deixaria com um valor restante muito baixo que está impossibilitando minha subsistência devido à necessidade de alugar um espaço para morar além da alimentação descontos de taxas e impostos direto em folha que não consigo deixar de pagar e demais custos de subsistência alem de eu fornecer recursos para uma enteada que embora não seja legalmente de minha responsabilidade depende de mim juntamente com a mãe e quase nenhum auxílio financeiro do pai para subsistir. o valor que tenho recebido de forma líquida tem orbitado em torno dos r30000 trezentos reais mais um adiantamento que tem sido de aproximadamente r 170000 mil e setecentos reais os quais somados resultando em cerca de 2 mil não estão sendo o suficiente para a minha subsistência por mais que eu tenha tentado economizar. as contas mensais não fecham desde o início do mês especialmente após a mudança para o centro onde pago 750 reais para morar em um quarto de pensão com banheiro particular e cozinha coletiva. de janeiro para cá já necessitei por duas vezes contratar empréstimo com o banco sicoob onde recebo o salário da prefeitura como correntista o que também tem comprometido ainda mais as sobras do meu salário. portanto com base na lei 14.1812021 que prevê a proteção contra o superendividamento eu necessito que independente de juros e valor total de crédito o valor da parcela seja reduzido para que eu possa ter a mínima condição de equilibrar as minhas contas e interromper o ciclo de superendividamento em curso que já está me colocando em situação de insegurança alimentar.
C6 Bank,em 2410 verifiquei o extrato do cartão de credito que não condizia com meus gastos pois seria maior no valor de 94 reiais. ao verificar a fundo descobri que eles fizeram um estorno do valor total de uma compra que fiz parcelada em 10x de r 56270 no dia 3009. o banco simplesmente me estornou o valor de r 5.62700 e continua a cobrar nos meses seguintes as parcelas de r 56270.
Nubank,preciso recuperar minha linhade credito pois o meu rating no banco esta baixo me ajude
Banco Inter (Banco Intermedium),recebi uma ligação do banco inter no número xxxxxx070perguntando se eu tinha feito um pix de 14.000e outro pix de 49.000 de imediato falei que não o homem que se dizia gerente de fraldes virtual sabia todos meus dados falou para eu estar entrando no aplicativo do cartão para cancelar o envio do pix quando apertei a msg de cancelamento o pix foi enviado sem pedir senha sem biometria do rosto. traduzido fui roubado entrei em contato com o banco para eles mem ajudarem .no momento que estava conversando com uma atendente do banco com o nome de rafaela ela presenciou o tal gerente virtual ligando novamente ela ficou surpressa pois sabiam todos meus dados ela até foi conferir se era alguém que trabalhava lá com eles.estou desesperado o banco não dá nenhum suporte .
Caixa Econômica Federal,eles me cobram sendo que tem que era descontado do bolsa família coisa deles com o governo até então não sabia que eles não estavam descontando eles não ligavam e nem falavam nada eu descobri sozinha que eles tinham negativado o meu nome a mais de um ano sem nem entrar em contato cobrando esse valor em coisa de 9 reais que ficava faltando do empréstimo eu fiz o pagamento porem depois de saber dos meus direitos quero que eles coloquem um valor justo e me devolvam o restante se não irei atrás dos meus direitos por danos morais.
Banco Santander,boa tarde solicito por gentileza verificar a retirada da cobrança do seguro prestamista do contrato nº 869901690 do banco santander o qual se refere ao empréstimo consignado que desconta em meu contra cheque. desde já agradeço
Banco do Brasil,banco do brasil agencia xxxxxx conta xxxxxx 11 9 xxxxxx026 meu celular pessoal não consigo credito em nenhum banco gostaria que retirasse meu nome dos histórico de endividados estou quase 3 anos sem ter credito na praça por favor solicito um ajuda pelo amor de deus.
Banco Bradesco,contratei um creditoo pessoal com o banco bradesco. tive um problema financeiro e acabei atrasando as parcelas do pagamento em 85 dias. quando entrei em contato com o banco para pagar a dívida fui informado que a minha dívida estava em 2900.00. fui questionar o valor dos juros que estava muito alto e fui informado que eu estava pagando juros diários de mais de 1 ao dia. nesses 85 dias de atraso dessas parcelas o banco está me cobrando mais de 500 de juros. eu creio que isso se caracteriza juros abusivos. tentei negociar o valor com uns juros mais justo e fui informado que isso não é possível.
Mercado Pago,solicitei que não ligassem mais para o número ddd 16 pois não pertence a mim e sim a um excliente. avisei que o meu número é ddd 51 e parassem de ligar ao número incorreto. não atenderam o solicitado e não consigo contato algum com um atendente só gravações. gostaria que isso fosse resolvido pois cobrança indevida é proibido pela lei.
Nubank,fui roubado  meu cartão  celular senha tudo estava junto eu não reconheço essa dívida não tenho como pagar uma dívida se não fui eu que fiz queria ver uma solução pra resolver isso
Mercado Pago,efetuei minha portabilidade no mês passado para o mercadopago com a promessa que seria ativado o benefício meli gratuitamente pela portabilidade fui informado que o meli seria ativo assim que caísse o primeiro salário pois bem no dia 3009 recebi o salário na portabilidade do mercadopago e o meli não foi ativo entrei em contato imediatamente com a central e me informaram que até o final da tarde do mesmo dia iria ser ativo passou 2 dias e não foi ativo liguei novamente e me informaram que iriam abrir um chamado pois o benefício não foi ativo 344332916 pois bem dia seguinte recebo a mensagem do chamado falando que o benefício foi ativado e foi ocasionado por uma falha sistêmica no aplicativo ao entrar no aplicativo foi constatado que não foi ativado nenhum benefício pois bem no mesmo dia liguei novamente e depois de ser atendido por 7 funcionários diferentes o ultimo abriu o mesmo chamado 344691120 na data de hoje recebo um email do mercadopago informando a mesma coisa que o benefício foi ativado e teria um erro sistêmico e ao entrar no aplicativo a mesma coisa o benefício não foi ativado mandei mensagem nos 2 chamados abertos e um deles a atendente monique simplesmente fala que tenho que aceitar os termos e não me diz como aceitar os termos e simplesmente fecha o chamado sem mais informações sou cliente há anos do mercadopago e mercadolivre e nunca passei um estresse tão grande como esse já perdi inúmeras promoções e produtos que eu queria e tendo que ligar todo santo dia e receber a mesma resposta estou abrindo aqui uma reclamação e se não resolver irei seguir por outros meios espero a resposta concreta e a resolução do meu problema com urgência
Caixa Econômica Federal,ontem foi transferido 2 pix pra mim mas até o momento não caiu na minha conta da caixa liguei na central e a menina que me atendeu do nome de júlia protocolo  xxx.xxx.xxxxx83543  disse que o setor responsável da caixa estava resolvendo a situação pois deu um problema de transferência quero que resolva pois preciso do dinheiro pix picpay  caixa  id transação exxx.xxx.xxxxxxxx.xxx.xxxxx520127086 pix digio  caixa  exxx.xxx.xxxxx410240238cyqs
Banco do Brasil,tendo em vista que fiz o programa desenrola brasil no qual pago todo mês  o motivo de minha reclamação e que ainda costa debito no banco do brasil  para que não aja prejuízo maior peço para dar baixa. sem grato..
