Empresa,Relato
Nubank,em 2019 verifiquei a o extrato conta corrente na qual constava cobrança do serviço de movimentações bancarias .. no valor de 20.000 que por mim não é reconhecido pois eu não solicitei e não autorizei a contratação de nada. valor constava em debito por movimentações de fraude banco alega que foi eu que fiz as movimentações.
Banco Santander,pago sempre meu cartao em dia fiz um parcelamento do meu limite e msm assim meu cartão teve redução do limite sem prévio aviso.
Caixa Econômica Federal,recentemente fui consultar o meu saldo de pontos do cartão e me deparei com duas inconsistências 1  pontos expirando que em nenhum momento fui informada pelo contrário. ao adquirir o cartão foi informado a todo tempo que os pontos do elo nanquin não expiram. eu mudei recentemente para a bandeira diners e antes de migrar liguei para a central para confirmar se os pontos iam expirar para que eu pudesse buscar alguma transferência de pontos e novamente fui informada que não precisava me preocupar pois os pontos não expiravam. pois bem fui verificar o saldo e para minha surpresa estou com 15.541 pontos expirados de maio a outubro e ainda com muitos pontos a expirar conforme resposta da central hoje  apenas leitura da resposta por telefone. outro problema é a soma de pontos que não fecha se somo a pontuação do mês mais o saldo anterior o saldo atual não fecha. tive que ligar na central pedindo retorno da contestação me informaram que consigo ver a resposta no aplicativo o que não é verdade nem no app e nem no site e simplesmente me informaram que o saldo expira em 24 ou 36 meses a depender do contrato. que contrato eu não assinei nenhum contrato a contratação foi por telefone e nunca ninguém me informou que os pontos expiravam. se fazer pesquisa no google o cartão elo nanquim fala que os pontos nunca expiram. a própria central me informou isso por mais de uma vez e por isso me sinto lesada com essa falta de transparência da caixa cartões pois se eu tivesse conhecimento que os pontos expiravam eu tinha resgatado não ia perder ponto de graça. quero que a caixa me comprove onde tem documento assinado com essas condições comerciais informadas nunca soube aliás tenho vários amigos que também ficaram surpresos com essa informaçãoaté agora não localizei onde encontrar essa informação de prazo de pontos a expirar do cartão nanquim. podem acessar o meu histórico com a central que me confirmaram varias vezes que os pontos não expiravam inclusive na ultima ligação em 3009 as 1800. peço esclarecimentos do controle de saldo de pontos bem como o reembolso de milhas expiradas uma vez que nunca tive informação clara e expressa da caixa cartões sobre essa expiração.
Banco Bradesco,ja fui varaisa vezes ao banco bradesco a mas de 2 anos estou tentantando uma proposta de negociaçaoi ja informei que estou superindividado pago pensao alimenticia que gostaria de poder estar sanando minha divida mas ate hoje nao oferecem uma proposta pedem pra aguardar que vao entrar em contato e a dicida so aumenta e nao consigo fazer um emprestimo para tentar pagar uma parte pois meu cpf aparece negativado para outras instituiçoes e se nao me engano nao poderia estar sendo posta a terceiros.
Nubank,cartão físico não está funcionando na função crédito até para pagamento como uber não pega.
Banco do Brasil,a divida cobrada através de processo judicial já estava prescrita e encerrada.
Caixa Econômica Federal,bloquearam minhas contas do nada e tinha um emprestimo pendente nao consegui puxar as parcelas do emprestimo nem indo na agencia e agora essa divida foi pro serasa e nao consigo pagar.
Banco Inter (Banco Intermedium),descontos indevido inss margem rmc cartão consignado banco903 inter s.a contrato10016059 protocoloxxx.xxx.xxxxx040 dia 17092024. atendentefelipe protocoloxxx.xxx.xxxxx0325 de 27092024 atendentesea.lorrane pereira rodrigues
Mercado Pago,mercado pago meu email xxxxxxxxxxxxxxxx.xxx não estou concequindo solicitar o meu cartão de crédito do mercado pago cartão virtual da erro não gera nada não tenho a opeção de crédito no mecado pago movimento a conta fiz o meli seguro se esse serviço ficar assim com escrito em cime ficarei triste com vcs e deslocarei a minha chave pix para outra istituição que me acolhe e me atenda de tudo
Nubank,bom dia gosto muito do nubank não tenho o que reclamar do banco porém tive alguns problemas financeiros e nunca atrasei uma fatura sempre paguei em dia só que com esse problema acabei atrasando a fatura e não consegui pagar a entrada do parcelamento da fatura preciso negociar inicialmente uma entrada que seja facilitada para conseguir pagar e não ficar sem o cartão pois preciso dele estou abrindo uma empresa o que irá melhorar financeiramente e pretendo assim que der quitar o cartão mas de primeiro momento preciso que a entrada seja viável gostaria de ver qual a possibilidade da entrada ser em torno de 400 e 500 reais e preciso que a parcela também seja acessivel pois meu salario é 3.00000 e mil reais pago só minha faculdade e não consigo pagar a parcela que fizeram. preciso de um retorno para não perder o cartão e conseguir parcelar com pagamento da entrada no quinto dia útil. e assim que entrar faturamento irei quitar tudo.
Mercado Pago,notificação extrajudicial  apropriação indébita e débito indevido pelo mercado pago à empresa cantinho da pizza sra. lilian nathalia da silva costa mercado pago cc banco central do brasil prezadosas venho por meio desta expressar formalmente minha insatisfação e exigir providências urgentes a respeito de um débito automático indevido realizado pelo mercado pago configurando inclusive apropriação indébita conforme o código penal brasileiro que impactou diretamente a entrega de um pedido essencial para um evento familiar. no dia 16102024 às 145835 efetuei o pagamento de r 36000 via pix para o número 81 xxxxxx008 de titularidade da sra. lilian nathalia da silva costa mercado pago referente à compra de 6 clones de pizza 12 pizzas e mais 1 clone de brinde totalizando 14 pizzas da empresa cantinho da pizza localizada em abreu e lima pernambuco. este pedido foi destinado ao aniversário da minha filha que ocorrerá no dia 02112024 um evento familiar com mais de 40 convidados. fui informado no entanto pelos proprietários da pizzaria via várias conversas através do whatsapp que é o mesmo número do pix que o valor pago foi automaticamente debitado para saldar uma dívida existente com o mercado pago sendo que a devolução do montante foi negada por falta de saldo. essa situação não apenas me deixou sem os produtos adquiridos mas também configurou uma apropriação indevida de valores por parte da plataforma de pagamento. apropriação indébita  código penal brasileiro nos termos do art. 168 do código penal a apropriação indébita ocorre quando alguém se apropria de um valor ou bem alheio que lhe foi confiado  art. 168  apropriarse de coisa alheia móvel de que tem a posse ou a detenção  pena reclusão de 1 um a 4 quatro anos e multa. o mercado pago ao debitar automaticamente o valor de uma transação comercial sem minha autorização e ao recusar a devolução dos r 36000 pagos configura claramente o crime de apropriação indébita. a partir do momento em que o valor foi transferido para a conta da pizzaria esse montante não poderia ser retido indevidamente para saldar dívidas da empresa sem meu conhecimento ou consentimento. violação dos direitos do consumidor como consumidor tenho meus direitos assegurados pelo código de defesa do consumidor cdc que entre outros garante  art. 14  responsabilidade do fornecedor por vícios de serviços e informações inadequadas.  art. 20  direito à reparação por falhas na prestação do serviço ou à devolução imediata do valor pago.  art. 22  obrigação do fornecedor em garantir a continuidade do serviço sem interrupções ou falhas que prejudiquem o consumidor. manter uma conta de recebimento ativa sabidamente negativada sem aviso prévio ao cliente configura grave falha no serviço prestado tanto pela pizzaria quanto pelo mercado pago.
Banco do Brasil,em outubro de 2022 assumi junto com o banco do brasil um compromisso de pagamento xxx.xxx.xxxxx298298 para quitação das minhas dúvidas juntas ao banco pela rolagem de crédito rotativo do cartão de crédito e juros acumulados no cheque especial. durante muitos meses paguei os juros tanto do rotativo com o do cheque especial até que não consegui mais pagar. a proposta do gerente do banco foi realizar tal compromisso para pagar uma dívida acumulativa de jutos no montante de r 26.20918. deste contrato mantive em dia até o mês de setembro pagando o total de r 14.84406 mas não estou mais conseguindo honrar com este valos mensal. entrei em contato sem sucesso com o banco para entender quanto deste valor seria o capital e quanto são jutos sobre jutos mas não obtive a resposta. entendo pelos meus cálculos que o valor do capital já foi pago a muito tempo o que estou pagando de forma exploradora são juros e mais juros. estou procurando uma proposta justa para quitação entendendo que o banco não teve nenhum tipo de prejuízo comigo até hoje.
Banco Santander,realizei a contratação de cartão de crédito do banco santander e refiz uma renegociação de 30 parcelas no valor de 57. todo mês eu pago e alguns pago em atraso mas nunca deixo de pagar. a parcela 27 venceu dia 0610 e hoje dia 1810 eu recebi um aviso do serasa que o banco santander solicitou meu nome junto ao órgão protetor. eu sei que está em atraso porém eu nunca fiquei sem pagar a dívida e em menos de 30dias eles colocam meu nome no serasa. me sinto com muito constrangimento sobre isso. se eu não pagasse a divida ok mas estou pagando. e esse mês que atrasei e não paguei ainda colocam meu nome no serasa.
Nubank,venho por meio deste relatar uma situação que em tese configura possível violação ao código de defesa do consumidor notadamente no que concerne à prática de propaganda enganosa e à falta de transparência na prestação de informações por parte do nubank. diversas publicidades e comunicações enviadas diretamente pelo nubank por meio de emails e notificações no aplicativo promoveram a oferta de benefícios associados à contratação do serviço ultravioleta tais como a disponibilização da nutag tag de pagamento para veículos e a assinatura de serviços como max entre outros. tais benefícios foram amplamente divulgados como vantagens para aquelas que se tornassem clientes da modalidade em questão. ao realizar a contratação do serviço observei que os benefícios mencionados não foram disponibilizados de imediato. em contato com o atendimento via chat fui informada de que os referidos benefícios estão sendo liberados de forma gradual. no entanto relatos de outros consumidores indicam que essa liberação gradual já se estende por mais de dois anos o que demonstra evidente morosidade e falta de clareza quanto aos critérios para tal liberação. a minha decisão de realizar investimentos e aderir ao serviço ultravioleta foi pautada na expectativa legítima de acesso aos benefícios promovidos nas campanhas publicitárias. sendo assim a não entrega desses benefícios conforme prometido caracteriza oferta não cumprida. além disso a ausência de informações claras e objetivas acerca dos prazos e critérios para a disponibilização dos benefícios oferecidos evidencia a prática de falta de transparência violando o direito básico da consumidora à informação adequada e clara previsto no cdc.
Banco Inter (Banco Intermedium),acabei em 2023 entrando no rotativo do cartão acumulando uma dívida no cartão de crédito do banco inter de r 5.53770 o valor das minhas compras eram infinitamente menores que este valor como meu nome foi parar no serasa e no registrato eu acabei aceitando um acordo contrato xxx.xxx.xxxxx831018 com o bando de pagar esta dívida na proposta enviada por email nunca consegui conversar com alguém e o acordo foi de 18 parcelas de r 69221 totalizando r 12.45978. consegui manter as parcelas em dias até a 10º parcela pagando então r 6.92210 mais do que era meu saldo devedor e agora estou tentando conversar com o banco sem sucesso para rever este acordo uma vez que já paguei mais do que eu devia originalmente e não tenho condições de pagar o saldo. entendo que a dívida já foi paga a muito tempo o que estou é pagando juro sobre juros.
Banco do Brasil,entrei em contato com o banco uma vez q já tinha pago a dívida faltando somente uma pequena parta fui até o banco com a intenção de quitar e o banco me informou q quitaria pagando todo o valor novamente que os valores q eu já havia pago não seria abatido.
Banco Bradesco,possuo um contrato de financiamento firmado junto ao banco porém não tenho a cópia do meu contrato.
Banco do Brasil,eu fernando sousa pereira cliente do banco do brasil venho por meio desta formalizar reclamação sobre débitos indevidos realizados em minha conta corrente referente ao pagamento do empréstimo consignado o qual já está sendo descontado diretamente de minha folha de pagamento junto à prefeitura. o referido empréstimo foi contratado com a condição de que as parcelas fossem descontadas diretamente de meus pagamentos mensais o que ocorre regularmente. no entanto na data de hoje 18102024 consta um débito de r 20549 duzentos e cinco reais e quarenta e nove centavos em minha conta corrente. diante do exposto solicito que essa situação seja resolvida com a máxima urgência uma vez que estou sendo prejudicado. requeiro ainda que toda a comunicação e a resposta a esta reclamação sejam enviadas para o meu endereço de email.
Mercado Pago,bom dia. no dia 0910 constam 13 aprovações no valor de r 11790 cada referente a apple.com totalizando o valor de r 1.53270 a qual não reconheço. tentei fazer a contestação pelo app porém não consegui pelo motivo de já ter sido feito compras na apple no periodo dos ultimos 6 meses. entrei em contato com o mp quem em primeiro momento a atendente beatriz me informou que nao poderiam seguir com estonro visto que já havia sido feito compras nesse site ocorre que em julho fiz uma assinatura da apple tv qual paguei o valor de r 1490 e r 2190 e em seguida foi cancelada. como podem tirar como base um assinatura de r 2190 para nao autorizarem o estorno de 13 autorizaçoes no valor de r 11790 feita em apenas um dia e no mesmo horario qualquer instituição financeira poderia constatar que se trata de fraude porém o mp autorizou todas elas sem nem sequer entrar em contato com o cliente para saber se a compra não é fraudulenta. hoje entrei em contato novamente com o mp falei com atendente hellen que me solicitou o print da assinatura cancelada. providenciei os prints porem quando entrei em contato novamente com a beatriz ela me informou que o valor não seria estornado e sim que nao haveria mais cobrança. não entendo essa politica enviei o print onde consta que nao tenho nenhuma assinatura ativa na apple e mesmo assim não querem estornar o valor de r 1.53270 que está sendo cobrada em minha fatura. houve ontem uma cobrança na uber no valor de r 1990 sendo que eu já havia feito o cancelamento do cartao virtual por ter sido fraudado. o mp pode me explicar como isso é possivel a fatura do meu cartão fechou e o assunto ainda nao foi resolvido eu nao tenho condições de pagar r 1.41480 a mais. entrei em contato com o mercado pago hoje novamente e me disseram que nao irão fazer a devolução .
Banco do Brasil,em 18102024 recebi um email da empresa ativos s.a.  securitizacao de creditos gestao de cobranca na qual constava cobrança do serviço de cartão de crédito no valor r 2.51707 que por mim não é reconhecido pois eu não solicitei e não autorizei a contratação. realizado contato com a empresa ativos s.a.  securitizacao de creditos gestao de cobranca no telefone xxxxxxxxxxxx030 no dia 1810 as 1002 da manha e não foi me fornecido numero de protocolo porém informada que a ligação foi gravada.
Banco Itaú Unibanco,meu nome consta com dívidas vencidas sendo que já foram pagasliquidadas sem prejuízo e ainda consta no registrado do bc banco itaú e luiza cred conforme relatório em anexo.
Nubank,é de estarrecer como uma instituição grande e sólida como o nubank não evolui no contato humano e na cortesia com os clientes. eu sou cliente há alguns anos recebo meu salário na instituição tenho o nome limpo renda de cerca de r 5.00000 mensal e não é concedido um limite de crédito maior que r 55000  eu já fiz empréstimos na plataforma pago antes do vencimento assim como o cartão de crédito com esse limite pífio e fica a impressão que sou um cliente desprezível...que não há interesse em minha manutenção na instituição. é incrível como pessoal com um salário mínimo e pouquissimo tempo de mercado consigam 51015 mil de cartão e o meu perfil não seja mais apreciado ou avaliado com melhor atenção.
C6 Bank,uma empresa do tamanho do c6 não ter um serviço de atendimento ao cliente ou uma postura melhor de relacionamento pessoal é estarrecedor. estou há meses com a conta aberto nome limpo bom score e não há possibilidade nenhuma de se pedir um cartão ou algum serviço de crédito. estou precisando e com vontade de utilizar a instituição mas não há interesse pelo visto. incrível como pessoal com o recebimento de 1 salário mínimo ou menos tem maior bom trato e crédito...
Banco Inter (Banco Intermedium),fiz um investimento de r 100000 em dezembro de 2023. o valor foi debitado da minha conta corrente e até hoje não apareceu como investimento em lugar nenhum. resumindo meu dinheiro sumiu ou melhor o banco inter sumiu com meu dinheiro. eu já entrei em contato com o banco inúmeras vezes para saber o que houve e reaver meu investimento mas sempre me dão a mesma resposta estão tratando como urgencia prioridade máxima mas nada acontece ninguém me retorna e ninguem resolve meu caso. o tratamento que eles estão dando ao meu caso é revoltante um descaso total e absoluto comigo e enquanto isso eu continuo sem meu dinheiro. se uma pessoa física vem me conta uma historia e me oferece um serviço e depois some com meu dinheiro isso é estelionato crime. e o banco fez isso. como fica
Caixa Econômica Federal,a história se repete. mais uma vez fiz o pagamento do boleto do fies da minha filha no dia 14.10.24 no valor r 59565 referente a parcela nº 073 com vencimento para o dia 15.10.24 ou seja antecipado. quando foi dia 15.10.24 foi descontado na conta dela ag 1549 conta xxxxxx o mesmo valor de r 59565. ou seja novamente a caixa econômica emite o boleto do fies e também lança o mesmo valor para débito em conta. desse jeito fica dificil pagar antecipado o valor do fies e ter o desprazer de pagar duas vezes e vir aqui solicitar que seja feito o reembolso do valor pago em duplicidade.
Banco Bradesco,pela terceira vez tenho que abrir reclamaçao neste canal para conseguir um simples boleto para fazer um pagamento do meu parcelamento conforme a bela resposta recebida documento em anexo na ultima reclamação foi informado que seria possivel obter o boleto pelo canal sac no 0800 704 8383 o qual fiz contato na data de hoje 1810 as 0845hs e atendente informa que nao pode me enviar o boleto pelo canal que ela atende isto já virou uma falta de respeito e sera a ultima vez que vou solicitar os boletos que alias tenho mais 07 parcelas e se os valores sao fixos porque simplesmente nao me enviam os 07 boletos a vencer pra nao precisar ficar me humilhando atras do documento em canais que nao atendem caso a situação nao se resolva irei abrir um processo por danos morais e constrangimento
Mercado Pago,bom dia na segundafeira dia 14102024 recebi um email que minha conta pessoal do mercado livre por irregularidades na identidade que você vinculou à sua conta que descumprem nossos termos e condições desde o dia 16102024 venho tentando contato através do link fornecido pela empresa para resolução do problema e não tenho obtido respostas esclarecedoras e que possam me ajudar a resolver o problema. como minha conta pessoal foi suspensa a conta da minha empresa também foi suspensa e não consigo realizar a compra dos suprimentos que necessito para o meu estabelecimento.
Mercado Pago,informo ao mercado pagomercado livre que houve uma contestação da compra no dia 30092024 junto ao banco no valor total de r 2.30038 e o valor já foi estornado no meu cartão uma vez que se trata de uma transação desconhecida que não foi realizada por mim. recebi 03 emails do mercado pago solicitando explicação do motivo da contestação da compra e que minha conta tinha sido bloqueada. no dia 14102024 entrei em contato via telefone com o mercado pago e recebi a informação de que só poderia incluir a explicação do motivo da contestação através da plataforma do mercado pago que pede para anexar documento com foto e cadastrar a biometria facial e que não tinha outra alternativa de acesso à plataforma. não desejo anexar documentos e nem cadastrar a biometria facial pois faz mais de 01 ano que não acesso o mercado pago e nem o mercado livre.
Caixa Econômica Federal,recebi um ted na minha conta corrente no valor r 225342  caixa e fe 104 0000  não sei da onde veio esse valor  qdo colono na internet refere se a fgts eu nao tenho pagamento de fgts como saber se ele valor e devido para mim  nenhum canal consegue me atender 
Banco Santander,conforme decisão do stf dividas prescritas não pode ser mais cobradas. solicito a baixa da minha divida do site do serasa.
Banco do Brasil,já encerrei a minha conta 24xxxxxx na agencia 1219x cpf 530.618.532.00 e ainda continua sem finalização pelo registrato do banco central também aparece prejuízo em meu nome sendo que parte eu negociei e já finalizei as prestações do acordo e outra parte foi vendida para outra empresa.
Banco Bradesco,solicito conforme relatório scr que consta débito em prejuizo que seja retirado do registrato.
Banco Itaú Unibanco,solicito a empresa que retire o apontamento no regiatrato como prejuizo em meu nome conforme relatório em anexo.
Banco Bradesco,solicito a retirada do meu nome da lista de prejuízo junto ao bacen e registrato
Banco do Brasil,fui procurada pelo sr. marco gerente banco do brasil oferecendo portabilidade do empréstimo que havia realizado no banco santander com uma promessa mais vantajosa com juros menores e uma parcela de r164100. a portabilidade foi aceita em 20102022. acontece que após o aceite da portabilidade o aplicativo mostrou parcelas maiores e são questionadas desde 14112022. a parcela de r1.64100 virou r1.71630. a cópia do contrato foi solicitada inúmeras vezes e não disponibilizam de forma alguma. até mesmo com a gerente geral da agencia na época soube do caso e não atendeu a solicitação. acontece que estou com problemas de saúde que me afastaram do trabalho desde 28052024 sem previsão de retorno e desde julho24 o banco do brasil não conseguiu descontar as parcelas do consignado devido ao afastamento. e então desde agosto2024 o banco adicionou uma restrição no meu cpf que é indevida por lei que garante que a dívida deve ficar suspensa por 180 dias sem prejuízo ao consumidor. considerando que o banco me importunou reiteradamente cobrando uma dívida suspensa resolvi dotada de boa fé atender os contados da gerente atual vanessa para solucionar o caso de forma amigável para quitação do valor total da dívida. ocorre que de forma oportunista o banco fez propostas ainda mais abusivas com valores para quitação superiores ao registrado na restrição não bastasse isso o banco ainda propôs o refinanciamento do saldo devedor que já é abusivo em parcelas ainda maiores o que é uma afronta a legislação bem como um desrespeito ao código de defesa do consumidor um absurdo colocando a consumidora em verdadeira desvantagem pelo estado de vulnerabilidade e humilhação o que não pode e não deve acontecer pois incontroverso que está configurado o dano material e moral que poderá ser acionado o judiciário para a resolução caso o banco se recuse a retirada da restrição e a quitação do débito devendo por obrigação facilitar a quitação do débito da consumidora e jamais criar embaraços e nem dificultar a transação como vem acontecendo desde a portabilidade conforme anexos.
